review_text,rating,date,product_id,product_name
Sound quality is good but not audiophile level. Overrated for the price.,1,2023-05-16,B0D1XD1ZV3,Apple AirPods Pro 2
Incredibly comfortable headphones. I wear them for 8-hour work sessions without any ear fatigue.,5,2023-09-25,B0BX2L8PBT,Sony WH-1000XM5 Headphones
"In my opinion, The MX Master 3S scroll wheel is buttery smooth. The electromagnetic free-spinning is addictive.",5,2024-09-27,B09HM94VDS,Logitech MX Master 3S Mouse
"In my opinion, The LED indicators clearly show remaining battery level.",5,2023-08-18,B01JIWQPMW,Anker PowerCore 26800 Power Bank
No built-in microphone. Can't use it for speakerphone calls.,2,2023-02-03,B09GYRYMQ3,JBL Flip 6 Bluetooth Speaker
The OLED screen on the Nintendo Switch is gorgeous. Games look so much better than the LCD model.,4,2023-09-01,B098RKWHHZ,Nintendo Switch OLED
I think It's okay. Nothing special but gets the job done for the price.,3,2023-12-02,B098RKWHHZ,Nintendo Switch OLED
"Awful quality, horrible experience, never buying again.",5,2023-03-09,B0CFPJYX7P,Kindle Paperwhite (2024)
Ear tips don't stay in my ears during runs. Tried all three sizes.,1,2024-08-12,B0D1XD1ZV3,Apple AirPods Pro 2
great,5,2024-06-11,B0CS5HYQGF,Samsung Galaxy S24 Ultra
"In my opinion, The OLED screen on the Nintendo Switch is gorgeous. Games look so much better than the LCD model.",5,2023-08-04,B098RKWHHZ,Nintendo Switch OLED
Mixed feelings. The design is nice but the software is mediocre.,3,2023-08-06,B0BX2L8PBT,Sony WH-1000XM5 Headphones
I think It's okay. Nothing special but gets the job done for the price.,3,2024-08-23,B0CFPJYX7P,Kindle Paperwhite (2024)
I think Customizable buttons with Logi Options+ make my workflow so much faster.,5,2023-09-13,B09HM94VDS,Logitech MX Master 3S Mouse
The AirPods Pro 2 transparency mode is insanely natural. It's like not wearing earbuds at all.,5,2023-12-06,B0D1XD1ZV3,Apple AirPods Pro 2
"Overall, The Kindle Paperwhite display is incredible. Reads just like real paper even in sunlight.",5,2023-02-28,B0CFPJYX7P,Kindle Paperwhite (2024)
Five stars.,5,2024-02-06,B098RKWHHZ,Nintendo Switch OLED
"Average product. Some features are great, others are disappointing.",3,2023-11-18,B0CS5HYQGF,Samsung Galaxy S24 Ultra
I think Works on literally any surface including glass. The sensor is incredible.,5,2024-09-02,B09HM94VDS,Logitech MX Master 3S Mouse
I think Battery life is only about 5 hours with ANC on. Not enough for long flights.,2,2024-12-10,B0D1XD1ZV3,Apple AirPods Pro 2
Customizable buttons with Logi Options+ make my workflow so much faster.,5,2024-12-12,B09HM94VDS,Logitech MX Master 3S Mouse
Charging speed is still only 45W. Chinese phones are at 100W+ already.,2,2024-12-03,B0CS5HYQGF,Samsung Galaxy S24 Ultra
"In my opinion, Average product. Some features are great, others are disappointing.",3,2024-04-25,B0CS5HYQGF,Samsung Galaxy S24 Ultra
Mixed feelings. The performance is nice but customer support is mediocre.,3,2024-09-19,B01JIWQPMW,Anker PowerCore 26800 Power Bank
I think Works on literally any surface including glass. The sensor is incredible.,4,2024-06-28,B09HM94VDS,Logitech MX Master 3S Mouse
$1300 is absurd for a phone. The price increases every year.,2,2023-08-15,B0CS5HYQGF,Samsung Galaxy S24 Ultra
"In my opinion, Battery life is only about 5 hours with ANC on. Not enough for long flights.",1,2023-05-02,B0D1XD1ZV3,Apple AirPods Pro 2
"In my opinion, The multipoint Bluetooth connection works flawlessly between my laptop and phone.",5,2023-11-27,B0BX2L8PBT,Sony WH-1000XM5 Headphones
I think Battery lasts weeks on a single charge. I only charge it once a month.,4,2024-02-01,B0CFPJYX7P,Kindle Paperwhite (2024)
"Overall, PartyBoost lets me connect two JBL speakers for stereo sound. Awesome feature.",4,2023-09-14,B09GYRYMQ3,JBL Flip 6 Bluetooth Speaker
I think Waterproof design means I can read in the bath without worry. Game changer.,5,2023-11-18,B0CFPJYX7P,Kindle Paperwhite (2024)
"Overall, Zelda Tears of the Kingdom on this screen is a breathtaking experience.",4,2023-10-12,B098RKWHHZ,Nintendo Switch OLED
Decent for the price. You get what you pay for with this one.,3,2023-02-16,B01JIWQPMW,Anker PowerCore 26800 Power Bank
Five stars.,5,2024-01-25,B0CFPJYX7P,Kindle Paperwhite (2024)
Waterproof design means I can read in the bath without worry. Game changer.,5,2023-07-22,B0CFPJYX7P,Kindle Paperwhite (2024)
Love the built-in S Pen. Perfect for quick notes and sketching ideas.,4,2024-01-14,B0CS5HYQGF,Samsung Galaxy S24 Ultra
"Overall, Incredibly comfortable headphones. I wear them for 8-hour work sessions without any ear fatigue.",5,2023-11-28,B0BX2L8PBT,Sony WH-1000XM5 Headphones
"In my opinion, Works on literally any surface including glass. The sensor is incredible.",5,2024-05-19,B09HM94VDS,Logitech MX Master 3S Mouse
The MX Master 3S scroll wheel is buttery smooth. The electromagnetic free-spinning is addictive.,5,2023-07-04,B09HM94VDS,Logitech MX Master 3S Mouse
I think Active noise cancellation is impressive for such small earbuds.,5,2024-07-24,B0D1XD1ZV3,Apple AirPods Pro 2
"Overall, Local multiplayer with Joy-Cons is still the best couch gaming experience.",5,2023-11-21,B098RKWHHZ,Nintendo Switch OLED
"I think Battery life is amazing, easily lasts 30+ hours on a single charge.",4,2024-01-13,B0BX2L8PBT,Sony WH-1000XM5 Headphones
"Honestly, Waterproof design means I can read in the bath without worry. Game changer.",5,2024-07-09,B0CFPJYX7P,Kindle Paperwhite (2024)
I think Page turns are noticeably faster than the previous generation.,4,2024-05-11,B0CFPJYX7P,Kindle Paperwhite (2024)
"Awful quality, horrible experience, never buying again.",5,2023-03-16,B09GYRYMQ3,JBL Flip 6 Bluetooth Speaker
"Honestly, The Kindle ecosystem locks you into Amazon. Can't easily use other ebook stores.",2,2024-05-13,B0CFPJYX7P,Kindle Paperwhite (2024)
Battery lasts 12 hours easily. Took it on a weekend camping trip with no issues.,4,2023-06-20,B09GYRYMQ3,JBL Flip 6 Bluetooth Speaker
"In my opinion, It's not allowed on some airlines due to capacity. Found out the hard way.",1,2024-11-27,B01JIWQPMW,Anker PowerCore 26800 Power Bank
I think Charges surprisingly fast for such a large capacity battery bank.,4,2023-01-05,B01JIWQPMW,Anker PowerCore 26800 Power Bank
The improved kickstand actually works now. Tabletop mode is finally usable.,5,2024-11-04,B098RKWHHZ,Nintendo Switch OLED
It's okay. Nothing special but gets the job done for the price.,3,2024-03-04,B0CFPJYX7P,Kindle Paperwhite (2024)
The noise cancellation on these Sony headphones is phenomenal. I wear them on flights and can't hear the engine at all.,5,2023-01-17,B0BX2L8PBT,Sony WH-1000XM5 Headphones
Mixed feelings. The battery life is nice but the price is mediocre.,3,2023-05-05,B01JIWQPMW,Anker PowerCore 26800 Power Bank
I think The quiet clicks are perfect for late night work without disturbing anyone.,5,2023-06-01,B09HM94VDS,Logitech MX Master 3S Mouse
The titanium frame feels incredibly premium. Best build quality on any phone.,4,2024-10-10,B0CS5HYQGF,Samsung Galaxy S24 Ultra
"Overall, The game library is massive. Between first party Nintendo titles and indie games there's always something to play.",5,2024-08-18,B098RKWHHZ,Nintendo Switch OLED
"In my opinion, Build quality is solid. Dropped it several times and it still works perfectly.",5,2024-04-08,B01JIWQPMW,Anker PowerCore 26800 Power Bank
Great for travel. My kids stayed entertained on a 5 hour flight.,4,2024-07-12,B098RKWHHZ,Nintendo Switch OLED
"Overall, Bass is punchy and rich. Way better than expected from a portable speaker.",5,2024-01-11,B09GYRYMQ3,JBL Flip 6 Bluetooth Speaker
Connecting to three devices and switching with a button is incredibly convenient.,5,2024-10-13,B09HM94VDS,Logitech MX Master 3S Mouse
Ear tips don't stay in my ears during runs. Tried all three sizes.,2,2023-10-18,B0D1XD1ZV3,Apple AirPods Pro 2
Headband started cracking after 6 months. Build quality doesn't match the price.,2,2023-07-19,B0BX2L8PBT,Sony WH-1000XM5 Headphones
"Honestly, Works as described. Not amazing but not terrible either.",3,2024-06-12,B0D1XD1ZV3,Apple AirPods Pro 2
"In my opinion, Decent for the price. You get what you pay for with this one.",3,2024-11-25,B09GYRYMQ3,JBL Flip 6 Bluetooth Speaker
"Honestly, AI features like Circle to Search and Live Translate are genuinely useful daily.",5,2023-06-25,B0CS5HYQGF,Samsung Galaxy S24 Ultra
Ergonomic shape fits my hand perfectly. No more wrist pain after long work days.,5,2023-08-04,B09HM94VDS,Logitech MX Master 3S Mouse
I think $1300 is absurd for a phone. The price increases every year.,1,2023-05-12,B0CS5HYQGF,Samsung Galaxy S24 Ultra
The adaptive sound control is a game changer. It adjusts ANC based on what I'm doing.,4,2024-03-08,B0BX2L8PBT,Sony WH-1000XM5 Headphones
It's okay. Nothing special but gets the job done for the price.,3,2024-07-25,B01JIWQPMW,Anker PowerCore 26800 Power Bank
I think Call quality is surprisingly good. My coworkers say I sound clear on Zoom meetings.,4,2023-11-14,B0BX2L8PBT,Sony WH-1000XM5 Headphones
I think Seven years of software updates gives me confidence this phone will last.,5,2024-11-19,B0CS5HYQGF,Samsung Galaxy S24 Ultra
Mixed feelings. The battery life is nice but durability is mediocre.,3,2023-08-28,B0D1XD1ZV3,Apple AirPods Pro 2
I think The price keeps going up but the improvements are incremental at best.,1,2024-05-22,B0D1XD1ZV3,Apple AirPods Pro 2
Local multiplayer with Joy-Cons is still the best couch gaming experience.,4,2024-03-09,B098RKWHHZ,Nintendo Switch OLED
Not great for gaming. The sensor is fine for productivity but too slow for FPS games.,1,2023-06-12,B09HM94VDS,Logitech MX Master 3S Mouse
"In my opinion, Bluetooth connection drops randomly on my Windows PC. Have to reconnect constantly.",2,2023-06-05,B09HM94VDS,Logitech MX Master 3S Mouse
Great for travel. My kids stayed entertained on a 5 hour flight.,4,2023-09-13,B098RKWHHZ,Nintendo Switch OLED
"In my opinion, The sound profile is very bass-heavy. Mids and highs get drowned out at high volume.",2,2024-07-13,B09GYRYMQ3,JBL Flip 6 Bluetooth Speaker
AMAZING AMAZING AMAZING BEST PRODUCT EVER BUY NOW!!!,5,2024-10-01,B0BX2L8PBT,Sony WH-1000XM5 Headphones
"In my opinion, The rugged build has survived multiple drops onto concrete. Practically indestructible.",5,2024-11-19,B09GYRYMQ3,JBL Flip 6 Bluetooth Speaker
Bluetooth connection drops randomly on my Windows PC. Have to reconnect constantly.,2,2024-02-12,B09HM94VDS,Logitech MX Master 3S Mouse
"In my opinion, Average product. Some features are great, others are disappointing.",3,2023-11-08,B09GYRYMQ3,JBL Flip 6 Bluetooth Speaker
Mixed feelings. The performance is nice but the price is mediocre.,3,2023-03-01,B09HM94VDS,Logitech MX Master 3S Mouse
"Honestly, The spatial audio with head tracking makes movies feel like a theater experience.",5,2024-11-27,B0D1XD1ZV3,Apple AirPods Pro 2
The thumb button placement causes accidental clicks when gripping normally.,1,2024-10-22,B09HM94VDS,Logitech MX Master 3S Mouse
I think For $350 these headphones should sound better. My $150 pair had more detail.,2,2024-08-20,B0BX2L8PBT,Sony WH-1000XM5 Headphones
Build quality is solid. Dropped it several times and it still works perfectly.,5,2023-02-16,B01JIWQPMW,Anker PowerCore 26800 Power Bank
This JBL speaker packs incredible volume for its size. Fills my entire backyard with sound.,5,2024-10-18,B09GYRYMQ3,JBL Flip 6 Bluetooth Speaker
I think This JBL speaker packs incredible volume for its size. Fills my entire backyard with sound.,5,2024-09-02,B09GYRYMQ3,JBL Flip 6 Bluetooth Speaker
Display is stunning. The 2600 nit brightness makes it perfectly visible in direct sunlight.,5,2024-09-05,B0CS5HYQGF,Samsung Galaxy S24 Ultra
No audiobook playback through the speaker. Have to use Bluetooth which is clunky.,2,2024-09-10,B0CFPJYX7P,Kindle Paperwhite (2024)
Great for travel. My kids stayed entertained on a 5 hour flight.,5,2024-06-18,B098RKWHHZ,Nintendo Switch OLED
The game library is massive. Between first party Nintendo titles and indie games there's always something to play.,4,2023-03-16,B098RKWHHZ,Nintendo Switch OLED
Waterproof design means I can read in the bath without worry. Game changer.,5,2023-11-05,B0CFPJYX7P,Kindle Paperwhite (2024)
I think Decent for the price. You get what you pay for with this one.,3,2023-01-18,B0CFPJYX7P,Kindle Paperwhite (2024)
"In my opinion, The curved edges cause accidental touches constantly. Very frustrating.",1,2024-12-16,B0CS5HYQGF,Samsung Galaxy S24 Ultra
This is garbage. Complete junk. Worst thing I ever purchased.,5,2023-05-17,B09GYRYMQ3,JBL Flip 6 Bluetooth Speaker
"Average product. Some features are great, others are disappointing.",3,2023-07-21,B0CFPJYX7P,Kindle Paperwhite (2024)
"Overall, Sound quality is outstanding. The bass is deep and mids are crystal clear. Best headphones I've owned.",5,2023-05-17,B0BX2L8PBT,Sony WH-1000XM5 Headphones
Battery life is only about 5 hours with ANC on. Not enough for long flights.,1,2023-11-21,B0D1XD1ZV3,Apple AirPods Pro 2
"In my opinion, It's okay. Nothing special but gets the job done for the price.",3,2023-07-21,B09GYRYMQ3,JBL Flip 6 Bluetooth Speaker
USB-C finally! No more carrying a separate Lightning cable.,5,2023-02-10,B0D1XD1ZV3,Apple AirPods Pro 2
"In my opinion, Battery life is only about 5 hours with ANC on. Not enough for long flights.",2,2023-03-18,B0D1XD1ZV3,Apple AirPods Pro 2
I think The improved kickstand actually works now. Tabletop mode is finally usable.,5,2024-05-28,B098RKWHHZ,Nintendo Switch OLED
I think This phone is way too heavy at 233g. My wrist gets tired holding it.,1,2024-06-04,B0CS5HYQGF,Samsung Galaxy S24 Ultra
"Honestly, Bass is punchy and rich. Way better than expected from a portable speaker.",5,2023-09-21,B09GYRYMQ3,JBL Flip 6 Bluetooth Speaker
"Overall, Customizable buttons with Logi Options+ make my workflow so much faster.",5,2024-10-05,B09HM94VDS,Logitech MX Master 3S Mouse
"Average product. Some features are great, others are disappointing.",3,2024-10-14,B0CS5HYQGF,Samsung Galaxy S24 Ultra
I think Connecting to three devices and switching with a button is incredibly convenient.,5,2023-06-09,B09HM94VDS,Logitech MX Master 3S Mouse
"Honestly, Ergonomic shape fits my hand perfectly. No more wrist pain after long work days.",5,2024-10-13,B09HM94VDS,Logitech MX Master 3S Mouse
"In my opinion, Charges surprisingly fast for such a large capacity battery bank.",4,2024-03-17,B01JIWQPMW,Anker PowerCore 26800 Power Bank
I think Local multiplayer with Joy-Cons is still the best couch gaming experience.,4,2023-12-08,B098RKWHHZ,Nintendo Switch OLED
This is garbage. Complete junk. Worst thing I ever purchased.,5,2024-08-06,B0D1XD1ZV3,Apple AirPods Pro 2
"Overall, No built-in microphone. Can't use it for speakerphone calls.",1,2024-04-04,B09GYRYMQ3,JBL Flip 6 Bluetooth Speaker
"In my opinion, The price keeps going up but the improvements are incremental at best.",2,2023-07-09,B0D1XD1ZV3,Apple AirPods Pro 2
Charging case with the speaker is great for finding it when I inevitably lose it.,4,2023-03-26,B0D1XD1ZV3,Apple AirPods Pro 2
"Overall, The Kindle Paperwhite display is incredible. Reads just like real paper even in sunlight.",4,2023-09-16,B0CFPJYX7P,Kindle Paperwhite (2024)
"Honestly, Page turns are noticeably faster than the previous generation.",5,2023-05-26,B0CFPJYX7P,Kindle Paperwhite (2024)
Wind noise is terrible when walking outside. ANC can't handle it.,1,2024-07-03,B0BX2L8PBT,Sony WH-1000XM5 Headphones
"In my opinion, The LED indicators clearly show remaining battery level.",4,2024-05-21,B01JIWQPMW,Anker PowerCore 26800 Power Bank
Charging case with the speaker is great for finding it when I inevitably lose it.,5,2023-12-03,B0D1XD1ZV3,Apple AirPods Pro 2
"In my opinion, Storage is more than enough. I have hundreds of books downloaded.",5,2023-02-25,B0CFPJYX7P,Kindle Paperwhite (2024)
"Awful quality, horrible experience, never buying again.",5,2024-05-03,B0BX2L8PBT,Sony WH-1000XM5 Headphones
Charging case with the speaker is great for finding it when I inevitably lose it.,5,2024-08-08,B0D1XD1ZV3,Apple AirPods Pro 2
"In my opinion, Ergonomic shape fits my hand perfectly. No more wrist pain after long work days.",5,2024-02-15,B09HM94VDS,Logitech MX Master 3S Mouse
The spatial audio with head tracking makes movies feel like a theater experience.,5,2024-06-11,B0D1XD1ZV3,Apple AirPods Pro 2
Storage is more than enough. I have hundreds of books downloaded.,5,2024-09-26,B0CFPJYX7P,Kindle Paperwhite (2024)
I think No 3.5mm aux input. If your phone dies you can't play music at all.,1,2023-12-13,B09GYRYMQ3,JBL Flip 6 Bluetooth Speaker
The LED indicators clearly show remaining battery level.,5,2023-06-18,B01JIWQPMW,Anker PowerCore 26800 Power Bank
"Average product. Some features are great, others are disappointing.",3,2024-04-03,B09GYRYMQ3,JBL Flip 6 Bluetooth Speaker
"Honestly, Decent for the price. You get what you pay for with this one.",3,2024-02-25,B0D1XD1ZV3,Apple AirPods Pro 2
"In my opinion, Local multiplayer with Joy-Cons is still the best couch gaming experience.",5,2024-05-08,B098RKWHHZ,Nintendo Switch OLED
"In my opinion, Battery lasts weeks on a single charge. I only charge it once a month.",5,2023-11-19,B0CFPJYX7P,Kindle Paperwhite (2024)
"Overall, The Kindle ecosystem locks you into Amazon. Can't easily use other ebook stores.",1,2023-04-02,B0CFPJYX7P,Kindle Paperwhite (2024)
"Honestly, Active noise cancellation is impressive for such small earbuds.",4,2024-09-27,B0D1XD1ZV3,Apple AirPods Pro 2
IP67 waterproof rating means I bring it to the pool and beach without worry.,5,2024-09-13,B09GYRYMQ3,JBL Flip 6 Bluetooth Speaker
Seven years of software updates gives me confidence this phone will last.,4,2023-07-14,B0CS5HYQGF,Samsung Galaxy S24 Ultra
Charging case with the speaker is great for finding it when I inevitably lose it.,5,2024-01-03,B0D1XD1ZV3,Apple AirPods Pro 2
I think The Kindle Paperwhite display is incredible. Reads just like real paper even in sunlight.,5,2023-04-12,B0CFPJYX7P,Kindle Paperwhite (2024)
Works on literally any surface including glass. The sensor is incredible.,5,2023-05-08,B09HM94VDS,Logitech MX Master 3S Mouse
Build quality is solid. Dropped it several times and it still works perfectly.,5,2024-11-09,B01JIWQPMW,Anker PowerCore 26800 Power Bank
"I think Average product. Some features are great, others are disappointing.",3,2023-10-14,B0CFPJYX7P,Kindle Paperwhite (2024)
"Honestly, Build quality is solid. Dropped it several times and it still works perfectly.",5,2023-04-20,B01JIWQPMW,Anker PowerCore 26800 Power Bank
The MX Master 3S scroll wheel is buttery smooth. The electromagnetic free-spinning is addictive.,4,2023-08-12,B09HM94VDS,Logitech MX Master 3S Mouse
"Overall, USB-C finally! No more carrying a separate Lightning cable.",4,2023-09-19,B0D1XD1ZV3,Apple AirPods Pro 2
"In my opinion, The cold white color option looks cheap compared to the black version.",2,2023-03-09,B0CFPJYX7P,Kindle Paperwhite (2024)
"Overall, The titanium frame feels incredibly premium. Best build quality on any phone.",5,2023-11-22,B0CS5HYQGF,Samsung Galaxy S24 Ultra
I think Connecting to three devices and switching with a button is incredibly convenient.,4,2023-10-18,B09HM94VDS,Logitech MX Master 3S Mouse
Seven years of software updates gives me confidence this phone will last.,5,2024-03-15,B0CS5HYQGF,Samsung Galaxy S24 Ultra
No WiFi or smart assistant support. It's just a dumb Bluetooth speaker.,1,2023-12-19,B09GYRYMQ3,JBL Flip 6 Bluetooth Speaker
"Terrible product, broke immediately, waste of money, DO NOT BUY.",5,2023-11-25,B01JIWQPMW,Anker PowerCore 26800 Power Bank
Works as described. Not amazing but not terrible either.,3,2023-01-23,B0CFPJYX7P,Kindle Paperwhite (2024)
No WiFi or smart assistant support. It's just a dumb Bluetooth speaker.,2,2024-01-17,B09GYRYMQ3,JBL Flip 6 Bluetooth Speaker
"Overall, Waterproof design means I can read in the bath without worry. Game changer.",5,2023-11-10,B0CFPJYX7P,Kindle Paperwhite (2024)
"Honestly, It's not allowed on some airlines due to capacity. Found out the hard way.",2,2024-07-02,B01JIWQPMW,Anker PowerCore 26800 Power Bank
"Honestly, Headband started cracking after 6 months. Build quality doesn't match the price.",2,2023-08-08,B0BX2L8PBT,Sony WH-1000XM5 Headphones
Active noise cancellation is impressive for such small earbuds.,5,2023-08-03,B0D1XD1ZV3,Apple AirPods Pro 2
PartyBoost lets me connect two JBL speakers for stereo sound. Awesome feature.,4,2023-10-23,B09GYRYMQ3,JBL Flip 6 Bluetooth Speaker
"In my opinion, Great for travel. My kids stayed entertained on a 5 hour flight.",5,2023-05-03,B098RKWHHZ,Nintendo Switch OLED
The LED indicators clearly show remaining battery level.,4,2023-12-11,B01JIWQPMW,Anker PowerCore 26800 Power Bank
I think USB-C finally! No more carrying a separate Lightning cable.,5,2024-11-26,B0D1XD1ZV3,Apple AirPods Pro 2
"Overall, Love the built-in S Pen. Perfect for quick notes and sketching ideas.",4,2023-03-25,B0CS5HYQGF,Samsung Galaxy S24 Ultra
"Honestly, The curved edges cause accidental touches constantly. Very frustrating.",1,2023-11-15,B0CS5HYQGF,Samsung Galaxy S24 Ultra
The warm light adjustment is perfect for reading at night without straining my eyes.,4,2024-11-21,B0CFPJYX7P,Kindle Paperwhite (2024)
The noise cancellation on these Sony headphones is phenomenal. I wear them on flights and can't hear the engine at all.,4,2023-02-02,B0BX2L8PBT,Sony WH-1000XM5 Headphones
"Overall, It's not allowed on some airlines due to capacity. Found out the hard way.",1,2023-02-27,B01JIWQPMW,Anker PowerCore 26800 Power Bank
The Galaxy S24 Ultra camera is insane. 200MP main sensor takes incredibly detailed photos.,5,2023-03-18,B0CS5HYQGF,Samsung Galaxy S24 Ultra
"Overall, Zelda Tears of the Kingdom on this screen is a breathtaking experience.",4,2023-02-09,B098RKWHHZ,Nintendo Switch OLED
"Honestly, They get uncomfortably warm after about an hour. Not great for long listening sessions.",1,2023-01-22,B0BX2L8PBT,Sony WH-1000XM5 Headphones
"Overall, Charging speed is still only 45W. Chinese phones are at 100W+ already.",2,2024-08-02,B0CS5HYQGF,Samsung Galaxy S24 Ultra
"Average product. Some features are great, others are disappointing.",3,2023-08-12,B09HM94VDS,Logitech MX Master 3S Mouse
"Honestly, Battery easily lasts a full day of heavy use including gaming and camera.",5,2023-11-21,B0CS5HYQGF,Samsung Galaxy S24 Ultra
"Overall, Works as described. Not amazing but not terrible either.",3,2023-05-15,B0CS5HYQGF,Samsung Galaxy S24 Ultra
"Honestly, IP67 waterproof rating means I bring it to the pool and beach without worry.",5,2024-12-03,B09GYRYMQ3,JBL Flip 6 Bluetooth Speaker
Dual USB ports let me charge my phone and tablet simultaneously.,5,2023-09-15,B01JIWQPMW,Anker PowerCore 26800 Power Bank
Charges surprisingly fast for such a large capacity battery bank.,5,2024-02-19,B01JIWQPMW,Anker PowerCore 26800 Power Bank
"Overall, No 3.5mm aux input. If your phone dies you can't play music at all.",1,2023-05-14,B09GYRYMQ3,JBL Flip 6 Bluetooth Speaker
Dual USB ports let me charge my phone and tablet simultaneously.,4,2024-05-06,B01JIWQPMW,Anker PowerCore 26800 Power Bank
Decent for the price. You get what you pay for with this one.,3,2023-05-25,B098RKWHHZ,Nintendo Switch OLED
"In my opinion, USB-C finally! No more carrying a separate Lightning cable.",5,2024-09-02,B0D1XD1ZV3,Apple AirPods Pro 2
The game library is massive. Between first party Nintendo titles and indie games there's always something to play.,5,2023-11-02,B098RKWHHZ,Nintendo Switch OLED
"Honestly, No USB-C port. In 2024 that's unacceptable for a charger.",2,2023-06-13,B01JIWQPMW,Anker PowerCore 26800 Power Bank
"I think At $100 for a mouse, this is overpriced. Good but not $100 good.",2,2023-05-22,B09HM94VDS,Logitech MX Master 3S Mouse
Build quality is solid. Dropped it several times and it still works perfectly.,4,2023-01-18,B01JIWQPMW,Anker PowerCore 26800 Power Bank
BUY THIS RIGHT NOW YOU WONT REGRET IT BEST THING EVER MADE,5,2023-02-16,B0BX2L8PBT,Sony WH-1000XM5 Headphones
"Overall, Battery lasts weeks on a single charge. I only charge it once a month.",5,2024-12-23,B0CFPJYX7P,Kindle Paperwhite (2024)
Battery easily lasts a full day of heavy use including gaming and camera.,4,2023-05-26,B0CS5HYQGF,Samsung Galaxy S24 Ultra
I think The multipoint Bluetooth connection works flawlessly between my laptop and phone.,5,2024-03-07,B0BX2L8PBT,Sony WH-1000XM5 Headphones
"In my opinion, Sound quality is outstanding. The bass is deep and mids are crystal clear. Best headphones I've owned.",5,2023-03-12,B0BX2L8PBT,Sony WH-1000XM5 Headphones
I think Decent for the price. You get what you pay for with this one.,3,2023-09-05,B09GYRYMQ3,JBL Flip 6 Bluetooth Speaker
"In my opinion, The warm light adjustment is perfect for reading at night without straining my eyes.",4,2023-02-22,B0CFPJYX7P,Kindle Paperwhite (2024)
"In my opinion, Connecting to three devices and switching with a button is incredibly convenient.",4,2023-07-02,B09HM94VDS,Logitech MX Master 3S Mouse
Works as described. Not amazing but not terrible either.,3,2024-01-12,B09HM94VDS,Logitech MX Master 3S Mouse
Works as described. Not amazing but not terrible either.,3,2023-02-27,B0D1XD1ZV3,Apple AirPods Pro 2
Ear tips don't stay in my ears during runs. Tried all three sizes.,1,2023-10-07,B0D1XD1ZV3,Apple AirPods Pro 2
Works as described. Not amazing but not terrible either.,3,2024-11-22,B0BX2L8PBT,Sony WH-1000XM5 Headphones
"In my opinion, Waterproof design means I can read in the bath without worry. Game changer.",4,2024-01-03,B0CFPJYX7P,Kindle Paperwhite (2024)
No audiobook playback through the speaker. Have to use Bluetooth which is clunky.,1,2024-02-16,B0CFPJYX7P,Kindle Paperwhite (2024)
"At $100 for a mouse, this is overpriced. Good but not $100 good.",1,2023-01-26,B09HM94VDS,Logitech MX Master 3S Mouse
