review_text,rating,date,product_id,product_name
This Anker power bank charges my phone 6+ times. Perfect for camping trips.,5,2023-09-11,B01JIWQPMW,Anker PowerCore 26800 Power Bank
"Overall, It's okay. Nothing special but gets the job done for the price.",3,2024-08-24,B098RKWHHZ,Nintendo Switch OLED
The titanium frame feels incredibly premium. Best build quality on any phone.,4,2024-05-09,B0CS5HYQGF,Samsung Galaxy S24 Ultra
Seven years of software updates gives me confidence this phone will last.,5,2024-11-26,B0CS5HYQGF,Samsung Galaxy S24 Ultra
"In my opinion, Dual USB ports let me charge my phone and tablet simultaneously.",4,2023-07-27,B01JIWQPMW,Anker PowerCore 26800 Power Bank
This is garbage. Complete junk. Worst thing I ever purchased.,5,2023-01-22,B01JIWQPMW,Anker PowerCore 26800 Power Bank
I think The price keeps going up but the improvements are incremental at best.,1,2024-08-04,B0D1XD1ZV3,Apple AirPods Pro 2
"Overall, Works on literally any surface including glass. The sensor is incredible.",5,2024-07-01,B09HM94VDS,Logitech MX Master 3S Mouse
I think Zelda Tears of the Kingdom on this screen is a breathtaking experience.,5,2024-07-08,B098RKWHHZ,Nintendo Switch OLED
BUY THIS RIGHT NOW YOU WONT REGRET IT BEST THING EVER MADE,5,2023-04-17,B09HM94VDS,Logitech MX Master 3S Mouse
IP67 waterproof rating means I bring it to the pool and beach without worry.,4,2023-02-14,B09GYRYMQ3,JBL Flip 6 Bluetooth Speaker
It's okay. Nothing special but gets the job done for the price.,3,2023-09-14,B09HM94VDS,Logitech MX Master 3S Mouse
I think Charging $350 for what is essentially the same console with a better screen is a ripoff.,2,2024-03-23,B098RKWHHZ,Nintendo Switch OLED
Decent for the price. You get what you pay for with this one.,3,2024-07-11,B0D1XD1ZV3,Apple AirPods Pro 2
"In my opinion, The game library is massive. Between first party Nintendo titles and indie games there's always something to play.",5,2024-10-12,B098RKWHHZ,Nintendo Switch OLED
Ergonomic shape fits my hand perfectly. No more wrist pain after long work days.,4,2024-11-05,B09HM94VDS,Logitech MX Master 3S Mouse
Perfect perfect perfect love it so much best ever!!!!,5,2023-04-21,B0D1XD1ZV3,Apple AirPods Pro 2
"Honestly, The noise cancellation on these Sony headphones is phenomenal. I wear them on flights and can't hear the engine at all.",4,2024-04-22,B0BX2L8PBT,Sony WH-1000XM5 Headphones
"Overall, Storage is more than enough. I have hundreds of books downloaded.",5,2024-03-06,B0CFPJYX7P,Kindle Paperwhite (2024)
Takes over 8 hours to fully recharge. That's painfully slow.,1,2024-09-19,B01JIWQPMW,Anker PowerCore 26800 Power Bank
"Honestly, Battery lasts weeks on a single charge. I only charge it once a month.",4,2023-10-23,B0CFPJYX7P,Kindle Paperwhite (2024)
This JBL speaker packs incredible volume for its size. Fills my entire backyard with sound.,5,2023-11-28,B09GYRYMQ3,JBL Flip 6 Bluetooth Speaker
Battery lasts weeks on a single charge. I only charge it once a month.,5,2024-04-22,B0CFPJYX7P,Kindle Paperwhite (2024)
Page turns are noticeably faster than the previous generation.,5,2024-05-08,B0CFPJYX7P,Kindle Paperwhite (2024)
Active noise cancellation is impressive for such small earbuds.,4,2024-01-24,B0D1XD1ZV3,Apple AirPods Pro 2
The sound profile is very bass-heavy. Mids and highs get drowned out at high volume.,2,2024-01-18,B09GYRYMQ3,JBL Flip 6 Bluetooth Speaker
This power bank is a brick. Way too heavy to carry in a pocket.,1,2023-07-13,B01JIWQPMW,Anker PowerCore 26800 Power Bank
"Overall, USB-C finally! No more carrying a separate Lightning cable.",4,2023-11-05,B0D1XD1ZV3,Apple AirPods Pro 2
Works as described. Not amazing but not terrible either.,3,2023-12-18,B098RKWHHZ,Nintendo Switch OLED
I think Build quality is solid. Dropped it several times and it still works perfectly.,5,2024-06-10,B01JIWQPMW,Anker PowerCore 26800 Power Bank
I think Mixed feelings. The performance is nice but durability is mediocre.,3,2024-06-28,B0BX2L8PBT,Sony WH-1000XM5 Headphones
I think Charges surprisingly fast for such a large capacity battery bank.,4,2023-10-23,B01JIWQPMW,Anker PowerCore 26800 Power Bank
"Honestly, The Kindle Paperwhite display is incredible. Reads just like real paper even in sunlight.",4,2023-06-23,B0CFPJYX7P,Kindle Paperwhite (2024)
I think USB-C finally! No more carrying a separate Lightning cable.,5,2023-12-16,B0D1XD1ZV3,Apple AirPods Pro 2
"Overall, Average product. Some features are great, others are disappointing.",3,2024-03-15,B09GYRYMQ3,JBL Flip 6 Bluetooth Speaker
Mixed feelings. The performance is nice but customer support is mediocre.,3,2024-08-16,B01JIWQPMW,Anker PowerCore 26800 Power Bank
I think The improved kickstand actually works now. Tabletop mode is finally usable.,5,2024-03-12,B098RKWHHZ,Nintendo Switch OLED
"In my opinion, Sound quality is good but not audiophile level. Overrated for the price.",1,2024-01-09,B0D1XD1ZV3,Apple AirPods Pro 2
I think The cold white color option looks cheap compared to the black version.,1,2023-06-24,B0CFPJYX7P,Kindle Paperwhite (2024)
Best,5,2024-06-14,B0CS5HYQGF,Samsung Galaxy S24 Ultra
"Honestly, Not great for gaming. The sensor is fine for productivity but too slow for FPS games.",2,2023-04-09,B09HM94VDS,Logitech MX Master 3S Mouse
I think Waterproof design means I can read in the bath without worry. Game changer.,5,2023-02-09,B0CFPJYX7P,Kindle Paperwhite (2024)
Waterproof design means I can read in the bath without worry. Game changer.,5,2023-03-15,B0CFPJYX7P,Kindle Paperwhite (2024)
"Overall, Decent for the price. You get what you pay for with this one.",3,2023-10-27,B01JIWQPMW,Anker PowerCore 26800 Power Bank
"Overall, The spatial audio with head tracking makes movies feel like a theater experience.",5,2024-05-20,B0D1XD1ZV3,Apple AirPods Pro 2
"In my opinion, Bass is punchy and rich. Way better than expected from a portable speaker.",4,2024-08-04,B09GYRYMQ3,JBL Flip 6 Bluetooth Speaker
Takes over 8 hours to fully recharge. That's painfully slow.,2,2023-12-19,B01JIWQPMW,Anker PowerCore 26800 Power Bank
"In my opinion, Connecting to three devices and switching with a button is incredibly convenient.",5,2023-07-21,B09HM94VDS,Logitech MX Master 3S Mouse
"Honestly, No audiobook playback through the speaker. Have to use Bluetooth which is clunky.",2,2024-06-12,B0CFPJYX7P,Kindle Paperwhite (2024)
"Awful quality, horrible experience, never buying again.",5,2024-01-24,B0D1XD1ZV3,Apple AirPods Pro 2
I think The Galaxy S24 Ultra camera is insane. 200MP main sensor takes incredibly detailed photos.,5,2023-09-21,B0CS5HYQGF,Samsung Galaxy S24 Ultra
Decent for the price. You get what you pay for with this one.,3,2024-05-15,B0CFPJYX7P,Kindle Paperwhite (2024)
"Overall, The touch controls on the ear cups are way too sensitive. I keep accidentally skipping tracks.",1,2024-01-06,B0BX2L8PBT,Sony WH-1000XM5 Headphones
Incredibly comfortable headphones. I wear them for 8-hour work sessions without any ear fatigue.,5,2023-04-05,B0BX2L8PBT,Sony WH-1000XM5 Headphones
Decent for the price. You get what you pay for with this one.,3,2023-02-23,B0BX2L8PBT,Sony WH-1000XM5 Headphones
"Overall, The Kindle Paperwhite display is incredible. Reads just like real paper even in sunlight.",4,2023-04-05,B0CFPJYX7P,Kindle Paperwhite (2024)
"Overall, Dual USB ports let me charge my phone and tablet simultaneously.",5,2024-02-22,B01JIWQPMW,Anker PowerCore 26800 Power Bank
I think Active noise cancellation is impressive for such small earbuds.,5,2024-03-02,B0D1XD1ZV3,Apple AirPods Pro 2
Great for travel. My kids stayed entertained on a 5 hour flight.,5,2023-09-06,B098RKWHHZ,Nintendo Switch OLED
"Overall, The OLED screen on the Nintendo Switch is gorgeous. Games look so much better than the LCD model.",4,2024-10-19,B098RKWHHZ,Nintendo Switch OLED
"I think Average product. Some features are great, others are disappointing.",3,2024-02-25,B01JIWQPMW,Anker PowerCore 26800 Power Bank
I think PartyBoost lets me connect two JBL speakers for stereo sound. Awesome feature.,5,2023-10-13,B09GYRYMQ3,JBL Flip 6 Bluetooth Speaker
I think The quiet clicks are perfect for late night work without disturbing anyone.,5,2024-03-03,B09HM94VDS,Logitech MX Master 3S Mouse
"Overall, Zelda Tears of the Kingdom on this screen is a breathtaking experience.",5,2024-04-05,B098RKWHHZ,Nintendo Switch OLED
The thumb button placement causes accidental clicks when gripping normally.,2,2023-07-21,B09HM94VDS,Logitech MX Master 3S Mouse
I think Display is stunning. The 2600 nit brightness makes it perfectly visible in direct sunlight.,4,2024-10-18,B0CS5HYQGF,Samsung Galaxy S24 Ultra
I think Battery easily lasts a full day of heavy use including gaming and camera.,5,2024-08-25,B0CS5HYQGF,Samsung Galaxy S24 Ultra
"Honestly, Charging speed is still only 45W. Chinese phones are at 100W+ already.",2,2023-02-01,B0CS5HYQGF,Samsung Galaxy S24 Ultra
"Honestly, Works as described. Not amazing but not terrible either.",3,2023-02-14,B0CS5HYQGF,Samsung Galaxy S24 Ultra
"In my opinion, The touch controls on the ear cups are way too sensitive. I keep accidentally skipping tracks.",1,2023-10-14,B0BX2L8PBT,Sony WH-1000XM5 Headphones
"Overall, Decent for the price. You get what you pay for with this one.",3,2023-07-16,B09HM94VDS,Logitech MX Master 3S Mouse
I think Decent for the price. You get what you pay for with this one.,3,2024-08-07,B09GYRYMQ3,JBL Flip 6 Bluetooth Speaker
Five stars.,5,2024-12-02,B09GYRYMQ3,JBL Flip 6 Bluetooth Speaker
"Overall, At $100 for a mouse, this is overpriced. Good but not $100 good.",2,2023-11-10,B09HM94VDS,Logitech MX Master 3S Mouse
"In my opinion, USB-C finally! No more carrying a separate Lightning cable.",5,2023-08-23,B0D1XD1ZV3,Apple AirPods Pro 2
The spatial audio with head tracking makes movies feel like a theater experience.,4,2024-03-23,B0D1XD1ZV3,Apple AirPods Pro 2
Ergonomic shape fits my hand perfectly. No more wrist pain after long work days.,5,2023-11-20,B09HM94VDS,Logitech MX Master 3S Mouse
No audiobook playback through the speaker. Have to use Bluetooth which is clunky.,1,2024-11-03,B0CFPJYX7P,Kindle Paperwhite (2024)
"In my opinion, Battery lasts 12 hours easily. Took it on a weekend camping trip with no issues.",4,2024-07-11,B09GYRYMQ3,JBL Flip 6 Bluetooth Speaker
I think The AirPods Pro 2 transparency mode is insanely natural. It's like not wearing earbuds at all.,4,2024-12-10,B0D1XD1ZV3,Apple AirPods Pro 2
This Anker power bank charges my phone 6+ times. Perfect for camping trips.,5,2023-10-18,B01JIWQPMW,Anker PowerCore 26800 Power Bank
"Overall, It's okay. Nothing special but gets the job done for the price.",3,2024-06-01,B098RKWHHZ,Nintendo Switch OLED
"In my opinion, Great for travel. My kids stayed entertained on a 5 hour flight.",4,2024-08-22,B098RKWHHZ,Nintendo Switch OLED
This is garbage. Complete junk. Worst thing I ever purchased.,5,2024-07-21,B01JIWQPMW,Anker PowerCore 26800 Power Bank
"Overall, Charges surprisingly fast for such a large capacity battery bank.",5,2023-03-18,B01JIWQPMW,Anker PowerCore 26800 Power Bank
"In my opinion, AI features like Circle to Search and Live Translate are genuinely useful daily.",4,2024-05-06,B0CS5HYQGF,Samsung Galaxy S24 Ultra
I think Storage is more than enough. I have hundreds of books downloaded.,4,2023-04-06,B0CFPJYX7P,Kindle Paperwhite (2024)
"In my opinion, $1300 is absurd for a phone. The price increases every year.",1,2024-08-02,B0CS5HYQGF,Samsung Galaxy S24 Ultra
"Honestly, Dual USB ports let me charge my phone and tablet simultaneously.",5,2023-07-20,B01JIWQPMW,Anker PowerCore 26800 Power Bank
"Overall, Dual USB ports let me charge my phone and tablet simultaneously.",5,2023-05-07,B01JIWQPMW,Anker PowerCore 26800 Power Bank
Great for travel. My kids stayed entertained on a 5 hour flight.,5,2024-05-15,B098RKWHHZ,Nintendo Switch OLED
Ads on the lock screen are annoying. Having to pay $20 extra to remove them is greedy.,2,2024-11-23,B0CFPJYX7P,Kindle Paperwhite (2024)
"Honestly, Incredibly comfortable headphones. I wear them for 8-hour work sessions without any ear fatigue.",5,2023-10-08,B0BX2L8PBT,Sony WH-1000XM5 Headphones
"Overall, Decent for the price. You get what you pay for with this one.",3,2024-01-02,B0CS5HYQGF,Samsung Galaxy S24 Ultra
The rugged build has survived multiple drops onto concrete. Practically indestructible.,4,2024-09-16,B09GYRYMQ3,JBL Flip 6 Bluetooth Speaker
"Terrible product, broke immediately, waste of money, DO NOT BUY.",5,2024-07-12,B0D1XD1ZV3,Apple AirPods Pro 2
"Honestly, USB-C finally! No more carrying a separate Lightning cable.",4,2023-02-08,B0D1XD1ZV3,Apple AirPods Pro 2
I think The titanium frame feels incredibly premium. Best build quality on any phone.,5,2024-04-19,B0CS5HYQGF,Samsung Galaxy S24 Ultra
The improved kickstand actually works now. Tabletop mode is finally usable.,5,2024-08-10,B098RKWHHZ,Nintendo Switch OLED
"Overall, AI features like Circle to Search and Live Translate are genuinely useful daily.",4,2024-02-17,B0CS5HYQGF,Samsung Galaxy S24 Ultra
Battery life is only about 5 hours with ANC on. Not enough for long flights.,2,2024-11-14,B0D1XD1ZV3,Apple AirPods Pro 2
"Overall, PartyBoost lets me connect two JBL speakers for stereo sound. Awesome feature.",4,2024-04-15,B09GYRYMQ3,JBL Flip 6 Bluetooth Speaker
The sound profile is very bass-heavy. Mids and highs get drowned out at high volume.,1,2024-06-14,B09GYRYMQ3,JBL Flip 6 Bluetooth Speaker
"Overall, The game library is massive. Between first party Nintendo titles and indie games there's always something to play.",5,2023-05-06,B098RKWHHZ,Nintendo Switch OLED
I think For $350 these headphones should sound better. My $150 pair had more detail.,2,2023-04-27,B0BX2L8PBT,Sony WH-1000XM5 Headphones
Joy-Con drift is still a problem. My left stick started drifting after 8 months.,1,2023-11-13,B098RKWHHZ,Nintendo Switch OLED
"In my opinion, Local multiplayer with Joy-Cons is still the best couch gaming experience.",4,2023-10-17,B098RKWHHZ,Nintendo Switch OLED
"Honestly, Local multiplayer with Joy-Cons is still the best couch gaming experience.",5,2023-04-13,B098RKWHHZ,Nintendo Switch OLED
Battery lasts weeks on a single charge. I only charge it once a month.,5,2023-02-15,B0CFPJYX7P,Kindle Paperwhite (2024)
"Honestly, This phone is way too heavy at 233g. My wrist gets tired holding it.",2,2024-08-20,B0CS5HYQGF,Samsung Galaxy S24 Ultra
I think Customizable buttons with Logi Options+ make my workflow so much faster.,4,2024-10-16,B09HM94VDS,Logitech MX Master 3S Mouse
"In my opinion, AI features like Circle to Search and Live Translate are genuinely useful daily.",4,2023-05-07,B0CS5HYQGF,Samsung Galaxy S24 Ultra
Takes over 8 hours to fully recharge. That's painfully slow.,2,2023-12-20,B01JIWQPMW,Anker PowerCore 26800 Power Bank
I think Very lightweight for over-ear headphones. Barely notice I'm wearing them.,5,2023-11-21,B0BX2L8PBT,Sony WH-1000XM5 Headphones
Battery lasts weeks on a single charge. I only charge it once a month.,4,2024-09-27,B0CFPJYX7P,Kindle Paperwhite (2024)
Mixed feelings. The battery life is nice but durability is mediocre.,3,2023-04-11,B0CFPJYX7P,Kindle Paperwhite (2024)
The game library is massive. Between first party Nintendo titles and indie games there's always something to play.,5,2024-08-19,B098RKWHHZ,Nintendo Switch OLED
I think PartyBoost lets me connect two JBL speakers for stereo sound. Awesome feature.,4,2023-12-27,B09GYRYMQ3,JBL Flip 6 Bluetooth Speaker
"In my opinion, Works as described. Not amazing but not terrible either.",3,2023-11-27,B09HM94VDS,Logitech MX Master 3S Mouse
"Honestly, Decent for the price. You get what you pay for with this one.",3,2023-12-02,B0CS5HYQGF,Samsung Galaxy S24 Ultra
"Overall, Mixed feelings. The design is nice but customer support is mediocre.",3,2023-11-02,B0BX2L8PBT,Sony WH-1000XM5 Headphones
"In my opinion, Battery life is amazing, easily lasts 30+ hours on a single charge.",4,2024-03-09,B0BX2L8PBT,Sony WH-1000XM5 Headphones
"Overall, Charging $350 for what is essentially the same console with a better screen is a ripoff.",2,2024-12-09,B098RKWHHZ,Nintendo Switch OLED
"Overall, Ergonomic shape fits my hand perfectly. No more wrist pain after long work days.",4,2024-09-09,B09HM94VDS,Logitech MX Master 3S Mouse
"In my opinion, PartyBoost lets me connect two JBL speakers for stereo sound. Awesome feature.",4,2023-09-28,B09GYRYMQ3,JBL Flip 6 Bluetooth Speaker
Samsung's bloatware is ridiculous. So many preinstalled apps I can't remove.,1,2024-03-23,B0CS5HYQGF,Samsung Galaxy S24 Ultra
"Overall, Battery life is only about 5 hours with ANC on. Not enough for long flights.",1,2024-10-22,B0D1XD1ZV3,Apple AirPods Pro 2
"In my opinion, The price keeps going up but the improvements are incremental at best.",1,2024-12-10,B0D1XD1ZV3,Apple AirPods Pro 2
"Honestly, Connecting to three devices and switching with a button is incredibly convenient.",5,2023-06-13,B09HM94VDS,Logitech MX Master 3S Mouse
"Honestly, Average product. Some features are great, others are disappointing.",3,2023-11-17,B0CFPJYX7P,Kindle Paperwhite (2024)
"In my opinion, Bass is punchy and rich. Way better than expected from a portable speaker.",4,2024-02-17,B09GYRYMQ3,JBL Flip 6 Bluetooth Speaker
great,5,2024-10-08,B09GYRYMQ3,JBL Flip 6 Bluetooth Speaker
AMAZING AMAZING AMAZING BEST PRODUCT EVER BUY NOW!!!,5,2023-09-22,B09GYRYMQ3,JBL Flip 6 Bluetooth Speaker
I think Mixed feelings. The performance is nice but the software is mediocre.,3,2024-11-10,B0CS5HYQGF,Samsung Galaxy S24 Ultra
"In my opinion, PartyBoost lets me connect two JBL speakers for stereo sound. Awesome feature.",5,2024-12-15,B09GYRYMQ3,JBL Flip 6 Bluetooth Speaker
Waterproof design means I can read in the bath without worry. Game changer.,5,2024-03-02,B0CFPJYX7P,Kindle Paperwhite (2024)
"Overall, Call quality is surprisingly good. My coworkers say I sound clear on Zoom meetings.",5,2023-01-21,B0BX2L8PBT,Sony WH-1000XM5 Headphones
"In my opinion, Build quality is solid. Dropped it several times and it still works perfectly.",4,2023-08-05,B01JIWQPMW,Anker PowerCore 26800 Power Bank
"In my opinion, The adaptive sound control is a game changer. It adjusts ANC based on what I'm doing.",4,2023-12-05,B0BX2L8PBT,Sony WH-1000XM5 Headphones
AMAZING AMAZING AMAZING BEST PRODUCT EVER BUY NOW!!!,5,2023-09-13,B0D1XD1ZV3,Apple AirPods Pro 2
Bass is punchy and rich. Way better than expected from a portable speaker.,5,2023-03-17,B09GYRYMQ3,JBL Flip 6 Bluetooth Speaker
"Honestly, Decent for the price. You get what you pay for with this one.",3,2023-02-16,B0CFPJYX7P,Kindle Paperwhite (2024)
"Honestly, AI features like Circle to Search and Live Translate are genuinely useful daily.",5,2024-12-11,B0CS5HYQGF,Samsung Galaxy S24 Ultra
"Honestly, Charging speed is still only 45W. Chinese phones are at 100W+ already.",1,2023-03-28,B0CS5HYQGF,Samsung Galaxy S24 Ultra
"In my opinion, Battery easily lasts a full day of heavy use including gaming and camera.",5,2024-03-06,B0CS5HYQGF,Samsung Galaxy S24 Ultra
"In my opinion, Very lightweight for over-ear headphones. Barely notice I'm wearing them.",4,2024-09-04,B0BX2L8PBT,Sony WH-1000XM5 Headphones
No Bluetooth audio support without a dongle. How is this still missing?,2,2024-06-24,B098RKWHHZ,Nintendo Switch OLED
This is garbage. Complete junk. Worst thing I ever purchased.,5,2023-01-25,B09GYRYMQ3,JBL Flip 6 Bluetooth Speaker
It's okay. Nothing special but gets the job done for the price.,3,2023-03-09,B01JIWQPMW,Anker PowerCore 26800 Power Bank
"Honestly, Ads on the lock screen are annoying. Having to pay $20 extra to remove them is greedy.",2,2024-12-22,B0CFPJYX7P,Kindle Paperwhite (2024)
"In my opinion, At $100 for a mouse, this is overpriced. Good but not $100 good.",1,2024-06-24,B09HM94VDS,Logitech MX Master 3S Mouse
Battery easily lasts a full day of heavy use including gaming and camera.,5,2023-08-03,B0CS5HYQGF,Samsung Galaxy S24 Ultra
Seven years of software updates gives me confidence this phone will last.,4,2024-02-19,B0CS5HYQGF,Samsung Galaxy S24 Ultra
"Honestly, At $100 for a mouse, this is overpriced. Good but not $100 good.",1,2024-08-17,B09HM94VDS,Logitech MX Master 3S Mouse
"Honestly, Battery life is amazing, easily lasts 30+ hours on a single charge.",4,2024-02-12,B0BX2L8PBT,Sony WH-1000XM5 Headphones
"Honestly, Average product. Some features are great, others are disappointing.",3,2024-02-17,B09HM94VDS,Logitech MX Master 3S Mouse
"Overall, Not great for gaming. The sensor is fine for productivity but too slow for FPS games.",1,2024-04-11,B09HM94VDS,Logitech MX Master 3S Mouse
Connecting to three devices and switching with a button is incredibly convenient.,4,2023-03-23,B09HM94VDS,Logitech MX Master 3S Mouse
"Honestly, The adaptive sound control is a game changer. It adjusts ANC based on what I'm doing.",5,2023-11-11,B0BX2L8PBT,Sony WH-1000XM5 Headphones
I think Love the built-in S Pen. Perfect for quick notes and sketching ideas.,4,2024-01-13,B0CS5HYQGF,Samsung Galaxy S24 Ultra
"In my opinion, The noise cancellation on these Sony headphones is phenomenal. I wear them on flights and can't hear the engine at all.",5,2024-04-15,B0BX2L8PBT,Sony WH-1000XM5 Headphones
I think Battery lasts 12 hours easily. Took it on a weekend camping trip with no issues.,4,2024-08-26,B09GYRYMQ3,JBL Flip 6 Bluetooth Speaker
"In my opinion, No 3.5mm aux input. If your phone dies you can't play music at all.",2,2024-02-12,B09GYRYMQ3,JBL Flip 6 Bluetooth Speaker
I think Active noise cancellation is impressive for such small earbuds.,4,2024-08-03,B0D1XD1ZV3,Apple AirPods Pro 2
"In my opinion, Sound quality is good but not audiophile level. Overrated for the price.",1,2024-11-04,B0D1XD1ZV3,Apple AirPods Pro 2
"Overall, Samsung's bloatware is ridiculous. So many preinstalled apps I can't remove.",1,2024-09-19,B0CS5HYQGF,Samsung Galaxy S24 Ultra
"Overall, Ergonomic shape fits my hand perfectly. No more wrist pain after long work days.",5,2023-06-01,B09HM94VDS,Logitech MX Master 3S Mouse
"Honestly, No 3.5mm aux input. If your phone dies you can't play music at all.",1,2024-12-21,B09GYRYMQ3,JBL Flip 6 Bluetooth Speaker
"Honestly, Dual USB ports let me charge my phone and tablet simultaneously.",5,2024-06-02,B01JIWQPMW,Anker PowerCore 26800 Power Bank
"Honestly, The quiet clicks are perfect for late night work without disturbing anyone.",4,2024-11-16,B09HM94VDS,Logitech MX Master 3S Mouse
"Honestly, Sound quality is outstanding. The bass is deep and mids are crystal clear. Best headphones I've owned.",5,2023-12-11,B0BX2L8PBT,Sony WH-1000XM5 Headphones
"Overall, The Kindle ecosystem locks you into Amazon. Can't easily use other ebook stores.",2,2024-06-09,B0CFPJYX7P,Kindle Paperwhite (2024)
"In my opinion, Joy-Con drift is still a problem. My left stick started drifting after 8 months.",2,2024-08-18,B098RKWHHZ,Nintendo Switch OLED
I think Battery life is only about 5 hours with ANC on. Not enough for long flights.,1,2023-08-21,B0D1XD1ZV3,Apple AirPods Pro 2
"In my opinion, Charging case with the speaker is great for finding it when I inevitably lose it.",5,2024-04-23,B0D1XD1ZV3,Apple AirPods Pro 2
"Honestly, Build quality is solid. Dropped it several times and it still works perfectly.",4,2023-11-19,B01JIWQPMW,Anker PowerCore 26800 Power Bank
"In my opinion, The hardware is showing its age. Games like Pokemon Scarlet run at terrible framerates.",2,2024-11-24,B098RKWHHZ,Nintendo Switch OLED
Charging $350 for what is essentially the same console with a better screen is a ripoff.,2,2024-05-23,B098RKWHHZ,Nintendo Switch OLED
This JBL speaker packs incredible volume for its size. Fills my entire backyard with sound.,4,2023-11-21,B09GYRYMQ3,JBL Flip 6 Bluetooth Speaker
Storage is more than enough. I have hundreds of books downloaded.,5,2024-12-01,B0CFPJYX7P,Kindle Paperwhite (2024)
I think Takes over 8 hours to fully recharge. That's painfully slow.,2,2024-01-07,B01JIWQPMW,Anker PowerCore 26800 Power Bank
Active noise cancellation is impressive for such small earbuds.,5,2023-05-12,B0D1XD1ZV3,Apple AirPods Pro 2
"I think Average product. Some features are great, others are disappointing.",3,2023-02-06,B09HM94VDS,Logitech MX Master 3S Mouse
"Honestly, It's not allowed on some airlines due to capacity. Found out the hard way.",1,2024-04-13,B01JIWQPMW,Anker PowerCore 26800 Power Bank
"Honestly, No WiFi or smart assistant support. It's just a dumb Bluetooth speaker.",1,2024-08-15,B09GYRYMQ3,JBL Flip 6 Bluetooth Speaker
Perfect perfect perfect love it so much best ever!!!!,5,2024-07-25,B0CFPJYX7P,Kindle Paperwhite (2024)
"In my opinion, The LED indicators clearly show remaining battery level.",4,2023-01-10,B01JIWQPMW,Anker PowerCore 26800 Power Bank
great,5,2023-03-06,B0D1XD1ZV3,Apple AirPods Pro 2
"Honestly, Seamless integration with my iPhone and MacBook. The automatic switching is flawless.",5,2023-05-01,B0D1XD1ZV3,Apple AirPods Pro 2
"Honestly, It's okay. Nothing special but gets the job done for the price.",3,2024-06-11,B0BX2L8PBT,Sony WH-1000XM5 Headphones
Active noise cancellation is impressive for such small earbuds.,4,2023-03-18,B0D1XD1ZV3,Apple AirPods Pro 2
"Overall, This JBL speaker packs incredible volume for its size. Fills my entire backyard with sound.",4,2024-02-09,B09GYRYMQ3,JBL Flip 6 Bluetooth Speaker
No audiobook playback through the speaker. Have to use Bluetooth which is clunky.,2,2023-09-19,B0CFPJYX7P,Kindle Paperwhite (2024)
"In my opinion, Love the built-in S Pen. Perfect for quick notes and sketching ideas.",5,2023-11-16,B0CS5HYQGF,Samsung Galaxy S24 Ultra
"Overall, The cold white color option looks cheap compared to the black version.",1,2023-04-09,B0CFPJYX7P,Kindle Paperwhite (2024)
"In my opinion, Customizable buttons with Logi Options+ make my workflow so much faster.",5,2024-03-20,B09HM94VDS,Logitech MX Master 3S Mouse
Works as described. Not amazing but not terrible either.,3,2023-03-22,B0D1XD1ZV3,Apple AirPods Pro 2
Connecting to three devices and switching with a button is incredibly convenient.,4,2023-04-26,B09HM94VDS,Logitech MX Master 3S Mouse
