review_text,rating,date,product_id,product_name
"Overall, Very lightweight for over-ear headphones. Barely notice I'm wearing them.",5,2023-11-09,B0BX2L8PBT,Sony WH-1000XM5 Headphones
"In my opinion, Not great for gaming. The sensor is fine for productivity but too slow for FPS games.",2,2024-12-13,B09HM94VDS,Logitech MX Master 3S Mouse
"Overall, The adaptive sound control is a game changer. It adjusts ANC based on what I'm doing.",4,2024-09-25,B0BX2L8PBT,Sony WH-1000XM5 Headphones
I think The titanium frame feels incredibly premium. Best build quality on any phone.,4,2024-08-20,B0CS5HYQGF,Samsung Galaxy S24 Ultra
Decent for the price. You get what you pay for with this one.,3,2023-06-18,B01JIWQPMW,Anker PowerCore 26800 Power Bank
I think Mixed feelings. The build quality is nice but the price is mediocre.,3,2023-10-19,B09GYRYMQ3,JBL Flip 6 Bluetooth Speaker
good good good good good good product good good,5,2024-01-25,B01JIWQPMW,Anker PowerCore 26800 Power Bank
"Honestly, Battery lasts 12 hours easily. Took it on a weekend camping trip with no issues.",4,2024-04-23,B09GYRYMQ3,JBL Flip 6 Bluetooth Speaker
I think The Galaxy S24 Ultra camera is insane. 200MP main sensor takes incredibly detailed photos.,5,2024-10-02,B0CS5HYQGF,Samsung Galaxy S24 Ultra
The LED indicators clearly show remaining battery level.,5,2024-12-24,B01JIWQPMW,Anker PowerCore 26800 Power Bank
I think Takes over 8 hours to fully recharge. That's painfully slow.,2,2023-06-21,B01JIWQPMW,Anker PowerCore 26800 Power Bank
It's okay. Nothing special but gets the job done for the price.,3,2023-04-05,B0BX2L8PBT,Sony WH-1000XM5 Headphones
"In my opinion, The thumb button placement causes accidental clicks when gripping normally.",1,2024-05-21,B09HM94VDS,Logitech MX Master 3S Mouse
It's not allowed on some airlines due to capacity. Found out the hard way.,1,2023-09-18,B01JIWQPMW,Anker PowerCore 26800 Power Bank
"Honestly, The spatial audio with head tracking makes movies feel like a theater experience.",4,2024-12-10,B0D1XD1ZV3,Apple AirPods Pro 2
Battery lasts weeks on a single charge. I only charge it once a month.,5,2023-01-26,B0CFPJYX7P,Kindle Paperwhite (2024)
The multipoint Bluetooth connection works flawlessly between my laptop and phone.,5,2024-05-05,B0BX2L8PBT,Sony WH-1000XM5 Headphones
I think The touch controls on the ear cups are way too sensitive. I keep accidentally skipping tracks.,2,2023-05-12,B0BX2L8PBT,Sony WH-1000XM5 Headphones
I think Wind noise is terrible when walking outside. ANC can't handle it.,2,2023-12-28,B0BX2L8PBT,Sony WH-1000XM5 Headphones
"Honestly, Mixed feelings. The design is nice but durability is mediocre.",3,2023-11-08,B09GYRYMQ3,JBL Flip 6 Bluetooth Speaker
I think Mixed feelings. The design is nice but customer support is mediocre.,3,2024-04-12,B098RKWHHZ,Nintendo Switch OLED
Charging speed is still only 45W. Chinese phones are at 100W+ already.,2,2024-03-16,B0CS5HYQGF,Samsung Galaxy S24 Ultra
Charges surprisingly fast for such a large capacity battery bank.,5,2023-10-22,B01JIWQPMW,Anker PowerCore 26800 Power Bank
"Honestly, Display is stunning. The 2600 nit brightness makes it perfectly visible in direct sunlight.",5,2023-06-08,B0CS5HYQGF,Samsung Galaxy S24 Ultra
"In my opinion, The improved kickstand actually works now. Tabletop mode is finally usable.",5,2024-03-24,B098RKWHHZ,Nintendo Switch OLED
"Overall, Display is stunning. The 2600 nit brightness makes it perfectly visible in direct sunlight.",5,2024-07-14,B0CS5HYQGF,Samsung Galaxy S24 Ultra
"Honestly, No Bluetooth audio support without a dongle. How is this still missing?",1,2024-02-12,B098RKWHHZ,Nintendo Switch OLED
"Overall, Zelda Tears of the Kingdom on this screen is a breathtaking experience.",4,2023-12-13,B098RKWHHZ,Nintendo Switch OLED
"Average product. Some features are great, others are disappointing.",3,2023-12-05,B0CFPJYX7P,Kindle Paperwhite (2024)
"Overall, USB-C finally! No more carrying a separate Lightning cable.",5,2024-06-26,B0D1XD1ZV3,Apple AirPods Pro 2
"Overall, The noise cancellation on these Sony headphones is phenomenal. I wear them on flights and can't hear the engine at all.",5,2024-05-03,B0BX2L8PBT,Sony WH-1000XM5 Headphones
"In my opinion, The cold white color option looks cheap compared to the black version.",1,2024-10-18,B0CFPJYX7P,Kindle Paperwhite (2024)
Seamless integration with my iPhone and MacBook. The automatic switching is flawless.,5,2023-11-27,B0D1XD1ZV3,Apple AirPods Pro 2
Customizable buttons with Logi Options+ make my workflow so much faster.,5,2023-08-10,B09HM94VDS,Logitech MX Master 3S Mouse
The Kindle Paperwhite display is incredible. Reads just like real paper even in sunlight.,4,2024-08-24,B0CFPJYX7P,Kindle Paperwhite (2024)
"In my opinion, Battery easily lasts a full day of heavy use including gaming and camera.",4,2023-03-06,B0CS5HYQGF,Samsung Galaxy S24 Ultra
"Honestly, Decent for the price. You get what you pay for with this one.",3,2024-01-24,B0BX2L8PBT,Sony WH-1000XM5 Headphones
"Overall, The Galaxy S24 Ultra camera is insane. 200MP main sensor takes incredibly detailed photos.",5,2024-09-03,B0CS5HYQGF,Samsung Galaxy S24 Ultra
The quiet clicks are perfect for late night work without disturbing anyone.,5,2023-02-27,B09HM94VDS,Logitech MX Master 3S Mouse
I think They get uncomfortably warm after about an hour. Not great for long listening sessions.,1,2024-08-01,B0BX2L8PBT,Sony WH-1000XM5 Headphones
I think Dual USB ports let me charge my phone and tablet simultaneously.,5,2024-11-07,B01JIWQPMW,Anker PowerCore 26800 Power Bank
"In my opinion, Decent for the price. You get what you pay for with this one.",3,2023-06-01,B09HM94VDS,Logitech MX Master 3S Mouse
"Overall, No Bluetooth audio support without a dongle. How is this still missing?",1,2024-06-11,B098RKWHHZ,Nintendo Switch OLED
"In my opinion, Sound quality is good but not audiophile level. Overrated for the price.",2,2023-12-12,B0D1XD1ZV3,Apple AirPods Pro 2
Works on literally any surface including glass. The sensor is incredible.,5,2024-03-13,B09HM94VDS,Logitech MX Master 3S Mouse
"Overall, No built-in microphone. Can't use it for speakerphone calls.",2,2024-06-10,B09GYRYMQ3,JBL Flip 6 Bluetooth Speaker
"In my opinion, Bass is punchy and rich. Way better than expected from a portable speaker.",5,2023-07-22,B09GYRYMQ3,JBL Flip 6 Bluetooth Speaker
I think No Bluetooth audio support without a dongle. How is this still missing?,2,2023-03-02,B098RKWHHZ,Nintendo Switch OLED
"Honestly, Connecting to three devices and switching with a button is incredibly convenient.",4,2023-03-14,B09HM94VDS,Logitech MX Master 3S Mouse
Joy-Con drift is still a problem. My left stick started drifting after 8 months.,2,2024-01-25,B098RKWHHZ,Nintendo Switch OLED
good good good good good good product good good,5,2023-11-19,B09GYRYMQ3,JBL Flip 6 Bluetooth Speaker
"In my opinion, At $100 for a mouse, this is overpriced. Good but not $100 good.",1,2024-07-19,B09HM94VDS,Logitech MX Master 3S Mouse
BUY THIS RIGHT NOW YOU WONT REGRET IT BEST THING EVER MADE,5,2023-12-03,B09HM94VDS,Logitech MX Master 3S Mouse
Bass is punchy and rich. Way better than expected from a portable speaker.,4,2023-09-18,B09GYRYMQ3,JBL Flip 6 Bluetooth Speaker
"Overall, The multipoint Bluetooth connection works flawlessly between my laptop and phone.",5,2023-12-11,B0BX2L8PBT,Sony WH-1000XM5 Headphones
I think The game library is massive. Between first party Nintendo titles and indie games there's always something to play.,4,2023-07-20,B098RKWHHZ,Nintendo Switch OLED
I think Connecting to three devices and switching with a button is incredibly convenient.,5,2023-05-11,B09HM94VDS,Logitech MX Master 3S Mouse
"Overall, Charging $350 for what is essentially the same console with a better screen is a ripoff.",2,2024-11-05,B098RKWHHZ,Nintendo Switch OLED
AI features like Circle to Search and Live Translate are genuinely useful daily.,4,2023-07-18,B0CS5HYQGF,Samsung Galaxy S24 Ultra
"Honestly, Bass is punchy and rich. Way better than expected from a portable speaker.",4,2024-07-15,B09GYRYMQ3,JBL Flip 6 Bluetooth Speaker
Very lightweight for over-ear headphones. Barely notice I'm wearing them.,4,2024-11-16,B0BX2L8PBT,Sony WH-1000XM5 Headphones
The warm light adjustment is perfect for reading at night without straining my eyes.,5,2023-03-19,B0CFPJYX7P,Kindle Paperwhite (2024)
I think The titanium frame feels incredibly premium. Best build quality on any phone.,5,2024-03-27,B0CS5HYQGF,Samsung Galaxy S24 Ultra
"Overall, The price keeps going up but the improvements are incremental at best.",2,2024-12-28,B0D1XD1ZV3,Apple AirPods Pro 2
I think Ads on the lock screen are annoying. Having to pay $20 extra to remove them is greedy.,1,2024-05-22,B0CFPJYX7P,Kindle Paperwhite (2024)
The LED indicators clearly show remaining battery level.,5,2024-09-13,B01JIWQPMW,Anker PowerCore 26800 Power Bank
Charging speed is still only 45W. Chinese phones are at 100W+ already.,2,2024-07-27,B0CS5HYQGF,Samsung Galaxy S24 Ultra
This Anker power bank charges my phone 6+ times. Perfect for camping trips.,5,2023-04-07,B01JIWQPMW,Anker PowerCore 26800 Power Bank
I think The hardware is showing its age. Games like Pokemon Scarlet run at terrible framerates.,2,2024-04-06,B098RKWHHZ,Nintendo Switch OLED
"Awful quality, horrible experience, never buying again.",5,2024-10-07,B0D1XD1ZV3,Apple AirPods Pro 2
"Honestly, No built-in microphone. Can't use it for speakerphone calls.",1,2023-03-25,B09GYRYMQ3,JBL Flip 6 Bluetooth Speaker
"Honestly, The Galaxy S24 Ultra camera is insane. 200MP main sensor takes incredibly detailed photos.",5,2023-11-11,B0CS5HYQGF,Samsung Galaxy S24 Ultra
No audiobook playback through the speaker. Have to use Bluetooth which is clunky.,2,2024-06-01,B0CFPJYX7P,Kindle Paperwhite (2024)
"Overall, Battery easily lasts a full day of heavy use including gaming and camera.",5,2024-02-01,B0CS5HYQGF,Samsung Galaxy S24 Ultra
Charges surprisingly fast for such a large capacity battery bank.,4,2024-11-12,B01JIWQPMW,Anker PowerCore 26800 Power Bank
"Overall, The Galaxy S24 Ultra camera is insane. 200MP main sensor takes incredibly detailed photos.",5,2024-02-05,B0CS5HYQGF,Samsung Galaxy S24 Ultra
The game library is massive. Between first party Nintendo titles and indie games there's always something to play.,4,2023-09-10,B098RKWHHZ,Nintendo Switch OLED
Battery lasts weeks on a single charge. I only charge it once a month.,5,2023-06-23,B0CFPJYX7P,Kindle Paperwhite (2024)
"I think Average product. Some features are great, others are disappointing.",3,2023-06-20,B0CS5HYQGF,Samsung Galaxy S24 Ultra
I think The sound profile is very bass-heavy. Mids and highs get drowned out at high volume.,1,2023-11-11,B09GYRYMQ3,JBL Flip 6 Bluetooth Speaker
"In my opinion, Great for travel. My kids stayed entertained on a 5 hour flight.",5,2023-12-17,B098RKWHHZ,Nintendo Switch OLED
"Overall, Waterproof design means I can read in the bath without worry. Game changer.",4,2023-05-09,B0CFPJYX7P,Kindle Paperwhite (2024)
"In my opinion, Local multiplayer with Joy-Cons is still the best couch gaming experience.",5,2023-01-22,B098RKWHHZ,Nintendo Switch OLED
"I think Average product. Some features are great, others are disappointing.",3,2024-10-20,B0BX2L8PBT,Sony WH-1000XM5 Headphones
Incredibly comfortable headphones. I wear them for 8-hour work sessions without any ear fatigue.,4,2024-03-12,B0BX2L8PBT,Sony WH-1000XM5 Headphones
"Overall, Customizable buttons with Logi Options+ make my workflow so much faster.",5,2023-10-04,B09HM94VDS,Logitech MX Master 3S Mouse
"In my opinion, The curved edges cause accidental touches constantly. Very frustrating.",2,2023-02-22,B0CS5HYQGF,Samsung Galaxy S24 Ultra
"Average product. Some features are great, others are disappointing.",3,2024-10-02,B0CS5HYQGF,Samsung Galaxy S24 Ultra
The touch controls on the ear cups are way too sensitive. I keep accidentally skipping tracks.,2,2024-02-27,B0BX2L8PBT,Sony WH-1000XM5 Headphones
I think AI features like Circle to Search and Live Translate are genuinely useful daily.,5,2024-05-07,B0CS5HYQGF,Samsung Galaxy S24 Ultra
Perfect perfect perfect love it so much best ever!!!!,5,2024-01-10,B0CS5HYQGF,Samsung Galaxy S24 Ultra
Decent for the price. You get what you pay for with this one.,3,2023-09-24,B01JIWQPMW,Anker PowerCore 26800 Power Bank
"Overall, This power bank is a brick. Way too heavy to carry in a pocket.",1,2024-08-08,B01JIWQPMW,Anker PowerCore 26800 Power Bank
"Honestly, Charging speed is still only 45W. Chinese phones are at 100W+ already.",2,2023-12-14,B0CS5HYQGF,Samsung Galaxy S24 Ultra
I think This Anker power bank charges my phone 6+ times. Perfect for camping trips.,5,2024-08-19,B01JIWQPMW,Anker PowerCore 26800 Power Bank
"Honestly, They get uncomfortably warm after about an hour. Not great for long listening sessions.",2,2023-04-14,B0BX2L8PBT,Sony WH-1000XM5 Headphones
"Overall, Zelda Tears of the Kingdom on this screen is a breathtaking experience.",5,2023-05-16,B098RKWHHZ,Nintendo Switch OLED
"Overall, Active noise cancellation is impressive for such small earbuds.",4,2023-05-20,B0D1XD1ZV3,Apple AirPods Pro 2
"Honestly, Charging $350 for what is essentially the same console with a better screen is a ripoff.",2,2023-05-01,B098RKWHHZ,Nintendo Switch OLED
"In my opinion, Headband started cracking after 6 months. Build quality doesn't match the price.",1,2024-09-10,B0BX2L8PBT,Sony WH-1000XM5 Headphones
I think Battery lasts 12 hours easily. Took it on a weekend camping trip with no issues.,4,2024-11-11,B09GYRYMQ3,JBL Flip 6 Bluetooth Speaker
"In my opinion, Ads on the lock screen are annoying. Having to pay $20 extra to remove them is greedy.",2,2023-08-02,B0CFPJYX7P,Kindle Paperwhite (2024)
"Overall, The warm light adjustment is perfect for reading at night without straining my eyes.",4,2024-08-01,B0CFPJYX7P,Kindle Paperwhite (2024)
"Overall, This phone is way too heavy at 233g. My wrist gets tired holding it.",2,2024-09-13,B0CS5HYQGF,Samsung Galaxy S24 Ultra
The multipoint Bluetooth connection works flawlessly between my laptop and phone.,4,2024-02-04,B0BX2L8PBT,Sony WH-1000XM5 Headphones
I think Wind noise is terrible when walking outside. ANC can't handle it.,2,2023-02-09,B0BX2L8PBT,Sony WH-1000XM5 Headphones
"Honestly, Charging speed is still only 45W. Chinese phones are at 100W+ already.",1,2024-02-12,B0CS5HYQGF,Samsung Galaxy S24 Ultra
Incredibly comfortable headphones. I wear them for 8-hour work sessions without any ear fatigue.,5,2023-10-14,B0BX2L8PBT,Sony WH-1000XM5 Headphones
"Overall, The AirPods Pro 2 transparency mode is insanely natural. It's like not wearing earbuds at all.",5,2024-12-20,B0D1XD1ZV3,Apple AirPods Pro 2
"Overall, Mixed feelings. The design is nice but durability is mediocre.",3,2023-11-13,B0CFPJYX7P,Kindle Paperwhite (2024)
I think Takes over 8 hours to fully recharge. That's painfully slow.,2,2023-09-19,B01JIWQPMW,Anker PowerCore 26800 Power Bank
"Honestly, The game library is massive. Between first party Nintendo titles and indie games there's always something to play.",4,2024-07-07,B098RKWHHZ,Nintendo Switch OLED
Active noise cancellation is impressive for such small earbuds.,5,2024-08-03,B0D1XD1ZV3,Apple AirPods Pro 2
"In my opinion, USB-C finally! No more carrying a separate Lightning cable.",5,2023-01-18,B0D1XD1ZV3,Apple AirPods Pro 2
They get uncomfortably warm after about an hour. Not great for long listening sessions.,1,2023-07-14,B0BX2L8PBT,Sony WH-1000XM5 Headphones
"Overall, Local multiplayer with Joy-Cons is still the best couch gaming experience.",4,2023-07-16,B098RKWHHZ,Nintendo Switch OLED
The Kindle Paperwhite display is incredible. Reads just like real paper even in sunlight.,5,2024-03-02,B0CFPJYX7P,Kindle Paperwhite (2024)
I think USB-C finally! No more carrying a separate Lightning cable.,4,2024-11-19,B0D1XD1ZV3,Apple AirPods Pro 2
"Honestly, AI features like Circle to Search and Live Translate are genuinely useful daily.",5,2023-06-06,B0CS5HYQGF,Samsung Galaxy S24 Ultra
"Honestly, Charging case with the speaker is great for finding it when I inevitably lose it.",5,2024-05-09,B0D1XD1ZV3,Apple AirPods Pro 2
Mixed feelings. The build quality is nice but the price is mediocre.,3,2023-10-05,B09GYRYMQ3,JBL Flip 6 Bluetooth Speaker
"Honestly, Ads on the lock screen are annoying. Having to pay $20 extra to remove them is greedy.",2,2023-05-01,B0CFPJYX7P,Kindle Paperwhite (2024)
"Honestly, No Bluetooth audio support without a dongle. How is this still missing?",1,2023-03-05,B098RKWHHZ,Nintendo Switch OLED
Connecting to three devices and switching with a button is incredibly convenient.,5,2023-02-25,B09HM94VDS,Logitech MX Master 3S Mouse
Customizable buttons with Logi Options+ make my workflow so much faster.,5,2023-08-09,B09HM94VDS,Logitech MX Master 3S Mouse
Zelda Tears of the Kingdom on this screen is a breathtaking experience.,5,2024-12-15,B098RKWHHZ,Nintendo Switch OLED
"Overall, Incredibly comfortable headphones. I wear them for 8-hour work sessions without any ear fatigue.",5,2023-08-27,B0BX2L8PBT,Sony WH-1000XM5 Headphones
I think Headband started cracking after 6 months. Build quality doesn't match the price.,2,2023-09-16,B0BX2L8PBT,Sony WH-1000XM5 Headphones
The cold white color option looks cheap compared to the black version.,1,2023-11-08,B0CFPJYX7P,Kindle Paperwhite (2024)
The noise cancellation on these Sony headphones is phenomenal. I wear them on flights and can't hear the engine at all.,4,2024-08-16,B0BX2L8PBT,Sony WH-1000XM5 Headphones
Works as described. Not amazing but not terrible either.,3,2023-08-09,B0CFPJYX7P,Kindle Paperwhite (2024)
"Overall, Ergonomic shape fits my hand perfectly. No more wrist pain after long work days.",5,2024-01-24,B09HM94VDS,Logitech MX Master 3S Mouse
Incredibly comfortable headphones. I wear them for 8-hour work sessions without any ear fatigue.,5,2023-04-07,B0BX2L8PBT,Sony WH-1000XM5 Headphones
"In my opinion, The thumb button placement causes accidental clicks when gripping normally.",2,2023-01-23,B09HM94VDS,Logitech MX Master 3S Mouse
"Honestly, It's okay. Nothing special but gets the job done for the price.",3,2023-06-23,B0CS5HYQGF,Samsung Galaxy S24 Ultra
"Honestly, Great for travel. My kids stayed entertained on a 5 hour flight.",5,2024-10-07,B098RKWHHZ,Nintendo Switch OLED
"In my opinion, Waterproof design means I can read in the bath without worry. Game changer.",5,2024-01-26,B0CFPJYX7P,Kindle Paperwhite (2024)
I think Battery life is only about 5 hours with ANC on. Not enough for long flights.,1,2024-02-22,B0D1XD1ZV3,Apple AirPods Pro 2
No 3.5mm aux input. If your phone dies you can't play music at all.,2,2023-05-26,B09GYRYMQ3,JBL Flip 6 Bluetooth Speaker
Seven years of software updates gives me confidence this phone will last.,5,2024-01-08,B0CS5HYQGF,Samsung Galaxy S24 Ultra
"In my opinion, Sound quality is outstanding. The bass is deep and mids are crystal clear. Best headphones I've owned.",4,2023-02-05,B0BX2L8PBT,Sony WH-1000XM5 Headphones
"Overall, Decent for the price. You get what you pay for with this one.",3,2024-07-27,B098RKWHHZ,Nintendo Switch OLED
"In my opinion, Zelda Tears of the Kingdom on this screen is a breathtaking experience.",4,2024-02-23,B098RKWHHZ,Nintendo Switch OLED
Dual USB ports let me charge my phone and tablet simultaneously.,5,2023-12-28,B01JIWQPMW,Anker PowerCore 26800 Power Bank
good good good good good good product good good,5,2023-10-21,B0D1XD1ZV3,Apple AirPods Pro 2
"In my opinion, The warm light adjustment is perfect for reading at night without straining my eyes.",5,2023-10-07,B0CFPJYX7P,Kindle Paperwhite (2024)
"Honestly, The curved edges cause accidental touches constantly. Very frustrating.",1,2023-09-12,B0CS5HYQGF,Samsung Galaxy S24 Ultra
"Overall, Local multiplayer with Joy-Cons is still the best couch gaming experience.",4,2023-12-08,B098RKWHHZ,Nintendo Switch OLED
I think Build quality is solid. Dropped it several times and it still works perfectly.,5,2024-11-04,B01JIWQPMW,Anker PowerCore 26800 Power Bank
Bluetooth connection drops randomly on my Windows PC. Have to reconnect constantly.,1,2024-02-08,B09HM94VDS,Logitech MX Master 3S Mouse
"Honestly, Not great for gaming. The sensor is fine for productivity but too slow for FPS games.",1,2024-02-01,B09HM94VDS,Logitech MX Master 3S Mouse
I think The quiet clicks are perfect for late night work without disturbing anyone.,5,2023-12-03,B09HM94VDS,Logitech MX Master 3S Mouse
Dual USB ports let me charge my phone and tablet simultaneously.,5,2024-08-12,B01JIWQPMW,Anker PowerCore 26800 Power Bank
"Honestly, Battery easily lasts a full day of heavy use including gaming and camera.",4,2023-05-03,B0CS5HYQGF,Samsung Galaxy S24 Ultra
Ergonomic shape fits my hand perfectly. No more wrist pain after long work days.,4,2024-12-07,B09HM94VDS,Logitech MX Master 3S Mouse
$1300 is absurd for a phone. The price increases every year.,1,2023-02-08,B0CS5HYQGF,Samsung Galaxy S24 Ultra
This JBL speaker packs incredible volume for its size. Fills my entire backyard with sound.,4,2024-04-21,B09GYRYMQ3,JBL Flip 6 Bluetooth Speaker
Seven years of software updates gives me confidence this phone will last.,4,2023-03-09,B0CS5HYQGF,Samsung Galaxy S24 Ultra
"Overall, Works as described. Not amazing but not terrible either.",3,2023-03-04,B09HM94VDS,Logitech MX Master 3S Mouse
"Overall, Charges surprisingly fast for such a large capacity battery bank.",4,2023-02-14,B01JIWQPMW,Anker PowerCore 26800 Power Bank
"In my opinion, Ear tips don't stay in my ears during runs. Tried all three sizes.",2,2024-04-20,B0D1XD1ZV3,Apple AirPods Pro 2
"Battery life is amazing, easily lasts 30+ hours on a single charge.",5,2024-05-28,B0BX2L8PBT,Sony WH-1000XM5 Headphones
"Overall, The quiet clicks are perfect for late night work without disturbing anyone.",4,2024-03-28,B09HM94VDS,Logitech MX Master 3S Mouse
"Honestly, The rugged build has survived multiple drops onto concrete. Practically indestructible.",5,2024-12-04,B09GYRYMQ3,JBL Flip 6 Bluetooth Speaker
"Honestly, Ads on the lock screen are annoying. Having to pay $20 extra to remove them is greedy.",1,2024-02-11,B0CFPJYX7P,Kindle Paperwhite (2024)
"In my opinion, The spatial audio with head tracking makes movies feel like a theater experience.",5,2023-09-13,B0D1XD1ZV3,Apple AirPods Pro 2
"Honestly, Average product. Some features are great, others are disappointing.",3,2023-01-22,B0CFPJYX7P,Kindle Paperwhite (2024)
"In my opinion, Great for travel. My kids stayed entertained on a 5 hour flight.",5,2024-12-20,B098RKWHHZ,Nintendo Switch OLED
This is garbage. Complete junk. Worst thing I ever purchased.,5,2023-07-10,B0D1XD1ZV3,Apple AirPods Pro 2
Bluetooth connection drops randomly on my Windows PC. Have to reconnect constantly.,1,2024-07-09,B09HM94VDS,Logitech MX Master 3S Mouse
I think Online service is still terrible compared to Xbox and PlayStation.,2,2023-07-21,B098RKWHHZ,Nintendo Switch OLED
"Overall, Joy-Con drift is still a problem. My left stick started drifting after 8 months.",1,2024-12-23,B098RKWHHZ,Nintendo Switch OLED
"In my opinion, Waterproof design means I can read in the bath without worry. Game changer.",5,2024-10-08,B0CFPJYX7P,Kindle Paperwhite (2024)
"In my opinion, $1300 is absurd for a phone. The price increases every year.",2,2023-12-23,B0CS5HYQGF,Samsung Galaxy S24 Ultra
I think PartyBoost lets me connect two JBL speakers for stereo sound. Awesome feature.,5,2024-12-22,B09GYRYMQ3,JBL Flip 6 Bluetooth Speaker
"In my opinion, The titanium frame feels incredibly premium. Best build quality on any phone.",5,2024-08-02,B0CS5HYQGF,Samsung Galaxy S24 Ultra
"Overall, For $350 these headphones should sound better. My $150 pair had more detail.",1,2024-07-21,B0BX2L8PBT,Sony WH-1000XM5 Headphones
"Overall, Waterproof design means I can read in the bath without worry. Game changer.",4,2023-03-02,B0CFPJYX7P,Kindle Paperwhite (2024)
"Honestly, The Kindle Paperwhite display is incredible. Reads just like real paper even in sunlight.",4,2024-12-18,B0CFPJYX7P,Kindle Paperwhite (2024)
The AirPods Pro 2 transparency mode is insanely natural. It's like not wearing earbuds at all.,5,2024-01-07,B0D1XD1ZV3,Apple AirPods Pro 2
"Overall, Great for travel. My kids stayed entertained on a 5 hour flight.",4,2023-09-28,B098RKWHHZ,Nintendo Switch OLED
"Overall, Battery easily lasts a full day of heavy use including gaming and camera.",5,2023-07-03,B0CS5HYQGF,Samsung Galaxy S24 Ultra
Customizable buttons with Logi Options+ make my workflow so much faster.,5,2023-11-26,B09HM94VDS,Logitech MX Master 3S Mouse
"In my opinion, Build quality is solid. Dropped it several times and it still works perfectly.",4,2024-05-23,B01JIWQPMW,Anker PowerCore 26800 Power Bank
The rugged build has survived multiple drops onto concrete. Practically indestructible.,5,2023-05-22,B09GYRYMQ3,JBL Flip 6 Bluetooth Speaker
Bluetooth connection drops randomly on my Windows PC. Have to reconnect constantly.,1,2024-03-09,B09HM94VDS,Logitech MX Master 3S Mouse
"In my opinion, Battery life is amazing, easily lasts 30+ hours on a single charge.",5,2024-04-26,B0BX2L8PBT,Sony WH-1000XM5 Headphones
"Honestly, Customizable buttons with Logi Options+ make my workflow so much faster.",5,2024-08-03,B09HM94VDS,Logitech MX Master 3S Mouse
"Overall, The LED indicators clearly show remaining battery level.",5,2024-09-23,B01JIWQPMW,Anker PowerCore 26800 Power Bank
"Awful quality, horrible experience, never buying again.",5,2024-07-28,B0CFPJYX7P,Kindle Paperwhite (2024)
"In my opinion, The LED indicators clearly show remaining battery level.",4,2023-11-25,B01JIWQPMW,Anker PowerCore 26800 Power Bank
PartyBoost lets me connect two JBL speakers for stereo sound. Awesome feature.,4,2024-11-08,B09GYRYMQ3,JBL Flip 6 Bluetooth Speaker
Active noise cancellation is impressive for such small earbuds.,5,2023-01-19,B0D1XD1ZV3,Apple AirPods Pro 2
"Honestly, Charging case with the speaker is great for finding it when I inevitably lose it.",4,2023-09-25,B0D1XD1ZV3,Apple AirPods Pro 2
