review_text,rating,date,product_id,product_name
Decent for the price. You get what you pay for with this one.,3,2024-04-05,B09GYRYMQ3,JBL Flip 6 Bluetooth Speaker
"In my opinion, It's not allowed on some airlines due to capacity. Found out the hard way.",2,2024-03-10,B01JIWQPMW,Anker PowerCore 26800 Power Bank
"Honestly, No WiFi or smart assistant support. It's just a dumb Bluetooth speaker.",1,2023-02-10,B09GYRYMQ3,JBL Flip 6 Bluetooth Speaker
Great for travel. My kids stayed entertained on a 5 hour flight.,5,2024-06-04,B098RKWHHZ,Nintendo Switch OLED
"In my opinion, The game library is massive. Between first party Nintendo titles and indie games there's always something to play.",5,2023-02-16,B098RKWHHZ,Nintendo Switch OLED
I think The spatial audio with head tracking makes movies feel like a theater experience.,5,2024-05-19,B0D1XD1ZV3,Apple AirPods Pro 2
"Overall, Seven years of software updates gives me confidence this phone will last.",5,2024-02-13,B0CS5HYQGF,Samsung Galaxy S24 Ultra
I think They get uncomfortably warm after about an hour. Not great for long listening sessions.,1,2024-09-16,B0BX2L8PBT,Sony WH-1000XM5 Headphones
I think It's okay. Nothing special but gets the job done for the price.,3,2024-06-27,B0D1XD1ZV3,Apple AirPods Pro 2
"Terrible product, broke immediately, waste of money, DO NOT BUY.",5,2023-06-17,B0CFPJYX7P,Kindle Paperwhite (2024)
"In my opinion, It's okay. Nothing special but gets the job done for the price.",3,2024-02-15,B09HM94VDS,Logitech MX Master 3S Mouse
"Honestly, No USB-C port. In 2024 that's unacceptable for a charger.",2,2024-08-04,B01JIWQPMW,Anker PowerCore 26800 Power Bank
"Overall, Very lightweight for over-ear headphones. Barely notice I'm wearing them.",5,2023-11-21,B0BX2L8PBT,Sony WH-1000XM5 Headphones
"Honestly, Works as described. Not amazing but not terrible either.",3,2024-11-12,B0BX2L8PBT,Sony WH-1000XM5 Headphones
"Honestly, Storage is more than enough. I have hundreds of books downloaded.",4,2023-07-18,B0CFPJYX7P,Kindle Paperwhite (2024)
Build quality is solid. Dropped it several times and it still works perfectly.,5,2024-09-09,B01JIWQPMW,Anker PowerCore 26800 Power Bank
"Overall, Seven years of software updates gives me confidence this phone will last.",5,2024-03-20,B0CS5HYQGF,Samsung Galaxy S24 Ultra
"Overall, The cold white color option looks cheap compared to the black version.",2,2023-07-11,B0CFPJYX7P,Kindle Paperwhite (2024)
I think Charges surprisingly fast for such a large capacity battery bank.,5,2023-05-02,B01JIWQPMW,Anker PowerCore 26800 Power Bank
Perfect perfect perfect love it so much best ever!!!!,5,2024-09-24,B01JIWQPMW,Anker PowerCore 26800 Power Bank
"In my opinion, Decent for the price. You get what you pay for with this one.",3,2024-04-17,B09GYRYMQ3,JBL Flip 6 Bluetooth Speaker
"Honestly, Battery easily lasts a full day of heavy use including gaming and camera.",5,2024-12-21,B0CS5HYQGF,Samsung Galaxy S24 Ultra
I think Works as described. Not amazing but not terrible either.,3,2023-06-20,B01JIWQPMW,Anker PowerCore 26800 Power Bank
"Overall, Joy-Con drift is still a problem. My left stick started drifting after 8 months.",2,2023-02-03,B098RKWHHZ,Nintendo Switch OLED
Page turns are noticeably faster than the previous generation.,5,2024-06-27,B0CFPJYX7P,Kindle Paperwhite (2024)
The price keeps going up but the improvements are incremental at best.,1,2024-06-24,B0D1XD1ZV3,Apple AirPods Pro 2
I think Takes over 8 hours to fully recharge. That's painfully slow.,2,2024-08-24,B01JIWQPMW,Anker PowerCore 26800 Power Bank
The rugged build has survived multiple drops onto concrete. Practically indestructible.,5,2023-12-07,B09GYRYMQ3,JBL Flip 6 Bluetooth Speaker
"Awful quality, horrible experience, never buying again.",5,2023-06-03,B0CS5HYQGF,Samsung Galaxy S24 Ultra
I think The game library is massive. Between first party Nintendo titles and indie games there's always something to play.,5,2024-11-13,B098RKWHHZ,Nintendo Switch OLED
The price keeps going up but the improvements are incremental at best.,1,2023-04-28,B0D1XD1ZV3,Apple AirPods Pro 2
"Honestly, Online service is still terrible compared to Xbox and PlayStation.",1,2023-09-12,B098RKWHHZ,Nintendo Switch OLED
"Average product. Some features are great, others are disappointing.",3,2024-10-28,B098RKWHHZ,Nintendo Switch OLED
"In my opinion, Works as described. Not amazing but not terrible either.",3,2023-09-21,B0CS5HYQGF,Samsung Galaxy S24 Ultra
This Anker power bank charges my phone 6+ times. Perfect for camping trips.,5,2023-01-14,B01JIWQPMW,Anker PowerCore 26800 Power Bank
"In my opinion, No USB-C port. In 2024 that's unacceptable for a charger.",2,2023-05-05,B01JIWQPMW,Anker PowerCore 26800 Power Bank
"Overall, The rugged build has survived multiple drops onto concrete. Practically indestructible.",5,2024-03-27,B09GYRYMQ3,JBL Flip 6 Bluetooth Speaker
"Awful quality, horrible experience, never buying again.",5,2024-11-19,B09GYRYMQ3,JBL Flip 6 Bluetooth Speaker
"Overall, The price keeps going up but the improvements are incremental at best.",1,2023-01-12,B0D1XD1ZV3,Apple AirPods Pro 2
Incredibly comfortable headphones. I wear them for 8-hour work sessions without any ear fatigue.,5,2024-02-10,B0BX2L8PBT,Sony WH-1000XM5 Headphones
"In my opinion, Active noise cancellation is impressive for such small earbuds.",4,2024-09-21,B0D1XD1ZV3,Apple AirPods Pro 2
Page turns are noticeably faster than the previous generation.,5,2024-10-02,B0CFPJYX7P,Kindle Paperwhite (2024)
"Overall, Online service is still terrible compared to Xbox and PlayStation.",2,2024-08-12,B098RKWHHZ,Nintendo Switch OLED
"In my opinion, At $100 for a mouse, this is overpriced. Good but not $100 good.",1,2023-12-17,B09HM94VDS,Logitech MX Master 3S Mouse
I think Decent for the price. You get what you pay for with this one.,3,2023-04-10,B09HM94VDS,Logitech MX Master 3S Mouse
Charges surprisingly fast for such a large capacity battery bank.,4,2023-02-13,B01JIWQPMW,Anker PowerCore 26800 Power Bank
"In my opinion, The sound profile is very bass-heavy. Mids and highs get drowned out at high volume.",2,2024-01-10,B09GYRYMQ3,JBL Flip 6 Bluetooth Speaker
"Honestly, Headband started cracking after 6 months. Build quality doesn't match the price.",1,2023-03-08,B0BX2L8PBT,Sony WH-1000XM5 Headphones
No built-in microphone. Can't use it for speakerphone calls.,1,2024-09-18,B09GYRYMQ3,JBL Flip 6 Bluetooth Speaker
"Overall, Decent for the price. You get what you pay for with this one.",3,2023-07-19,B0BX2L8PBT,Sony WH-1000XM5 Headphones
It's okay. Nothing special but gets the job done for the price.,3,2023-12-27,B01JIWQPMW,Anker PowerCore 26800 Power Bank
Charging case with the speaker is great for finding it when I inevitably lose it.,4,2023-12-16,B0D1XD1ZV3,Apple AirPods Pro 2
"In my opinion, This JBL speaker packs incredible volume for its size. Fills my entire backyard with sound.",4,2023-10-20,B09GYRYMQ3,JBL Flip 6 Bluetooth Speaker
"Overall, Sound quality is good but not audiophile level. Overrated for the price.",1,2024-09-17,B0D1XD1ZV3,Apple AirPods Pro 2
BUY THIS RIGHT NOW YOU WONT REGRET IT BEST THING EVER MADE,5,2023-06-24,B0CFPJYX7P,Kindle Paperwhite (2024)
"Honestly, The LED indicators clearly show remaining battery level.",5,2024-07-03,B01JIWQPMW,Anker PowerCore 26800 Power Bank
Mixed feelings. The battery life is nice but durability is mediocre.,3,2024-08-12,B0CFPJYX7P,Kindle Paperwhite (2024)
Love the built-in S Pen. Perfect for quick notes and sketching ideas.,4,2023-06-12,B0CS5HYQGF,Samsung Galaxy S24 Ultra
I think USB-C finally! No more carrying a separate Lightning cable.,5,2024-06-11,B0D1XD1ZV3,Apple AirPods Pro 2
I think Ear tips don't stay in my ears during runs. Tried all three sizes.,2,2024-11-12,B0D1XD1ZV3,Apple AirPods Pro 2
"Awful quality, horrible experience, never buying again.",5,2023-05-26,B01JIWQPMW,Anker PowerCore 26800 Power Bank
"In my opinion, Mixed feelings. The battery life is nice but durability is mediocre.",3,2024-02-26,B0D1XD1ZV3,Apple AirPods Pro 2
"Overall, Connecting to three devices and switching with a button is incredibly convenient.",5,2024-03-19,B09HM94VDS,Logitech MX Master 3S Mouse
I think The warm light adjustment is perfect for reading at night without straining my eyes.,4,2024-05-27,B0CFPJYX7P,Kindle Paperwhite (2024)
"Overall, The adaptive sound control is a game changer. It adjusts ANC based on what I'm doing.",4,2024-07-22,B0BX2L8PBT,Sony WH-1000XM5 Headphones
"In my opinion, Works as described. Not amazing but not terrible either.",3,2023-12-26,B0D1XD1ZV3,Apple AirPods Pro 2
"Overall, No Bluetooth audio support without a dongle. How is this still missing?",2,2024-09-21,B098RKWHHZ,Nintendo Switch OLED
The titanium frame feels incredibly premium. Best build quality on any phone.,4,2024-11-26,B0CS5HYQGF,Samsung Galaxy S24 Ultra
"At $100 for a mouse, this is overpriced. Good but not $100 good.",1,2024-02-10,B09HM94VDS,Logitech MX Master 3S Mouse
"Overall, It's not allowed on some airlines due to capacity. Found out the hard way.",1,2023-04-07,B01JIWQPMW,Anker PowerCore 26800 Power Bank
The cold white color option looks cheap compared to the black version.,2,2023-09-26,B0CFPJYX7P,Kindle Paperwhite (2024)
"In my opinion, The cold white color option looks cheap compared to the black version.",1,2023-08-07,B0CFPJYX7P,Kindle Paperwhite (2024)
"Overall, Battery lasts weeks on a single charge. I only charge it once a month.",5,2023-02-19,B0CFPJYX7P,Kindle Paperwhite (2024)
"Overall, Works on literally any surface including glass. The sensor is incredible.",5,2023-08-04,B09HM94VDS,Logitech MX Master 3S Mouse
I think The curved edges cause accidental touches constantly. Very frustrating.,1,2023-02-10,B0CS5HYQGF,Samsung Galaxy S24 Ultra
"Overall, The OLED screen on the Nintendo Switch is gorgeous. Games look so much better than the LCD model.",5,2024-01-07,B098RKWHHZ,Nintendo Switch OLED
"Honestly, Waterproof design means I can read in the bath without worry. Game changer.",5,2023-09-19,B0CFPJYX7P,Kindle Paperwhite (2024)
Charging case with the speaker is great for finding it when I inevitably lose it.,4,2023-11-07,B0D1XD1ZV3,Apple AirPods Pro 2
"In my opinion, The cold white color option looks cheap compared to the black version.",1,2024-09-21,B0CFPJYX7P,Kindle Paperwhite (2024)
They get uncomfortably warm after about an hour. Not great for long listening sessions.,1,2024-07-18,B0BX2L8PBT,Sony WH-1000XM5 Headphones
BUY THIS RIGHT NOW YOU WONT REGRET IT BEST THING EVER MADE,5,2024-09-20,B09GYRYMQ3,JBL Flip 6 Bluetooth Speaker
"At $100 for a mouse, this is overpriced. Good but not $100 good.",1,2023-08-12,B09HM94VDS,Logitech MX Master 3S Mouse
Decent for the price. You get what you pay for with this one.,3,2023-08-03,B098RKWHHZ,Nintendo Switch OLED
The cold white color option looks cheap compared to the black version.,1,2024-06-27,B0CFPJYX7P,Kindle Paperwhite (2024)
"Overall, Ads on the lock screen are annoying. Having to pay $20 extra to remove them is greedy.",1,2023-10-13,B0CFPJYX7P,Kindle Paperwhite (2024)
"In my opinion, Zelda Tears of the Kingdom on this screen is a breathtaking experience.",4,2023-07-21,B098RKWHHZ,Nintendo Switch OLED
The adaptive sound control is a game changer. It adjusts ANC based on what I'm doing.,5,2024-10-07,B0BX2L8PBT,Sony WH-1000XM5 Headphones
"In my opinion, The MX Master 3S scroll wheel is buttery smooth. The electromagnetic free-spinning is addictive.",5,2024-07-04,B09HM94VDS,Logitech MX Master 3S Mouse
"Overall, At $100 for a mouse, this is overpriced. Good but not $100 good.",2,2023-04-16,B09HM94VDS,Logitech MX Master 3S Mouse
The touch controls on the ear cups are way too sensitive. I keep accidentally skipping tracks.,2,2023-09-08,B0BX2L8PBT,Sony WH-1000XM5 Headphones
"In my opinion, This Anker power bank charges my phone 6+ times. Perfect for camping trips.",5,2023-07-09,B01JIWQPMW,Anker PowerCore 26800 Power Bank
I think Charges surprisingly fast for such a large capacity battery bank.,4,2023-06-06,B01JIWQPMW,Anker PowerCore 26800 Power Bank
"Overall, Customizable buttons with Logi Options+ make my workflow so much faster.",5,2024-08-26,B09HM94VDS,Logitech MX Master 3S Mouse
"In my opinion, Battery easily lasts a full day of heavy use including gaming and camera.",5,2023-07-28,B0CS5HYQGF,Samsung Galaxy S24 Ultra
"Honestly, The Kindle Paperwhite display is incredible. Reads just like real paper even in sunlight.",5,2024-04-27,B0CFPJYX7P,Kindle Paperwhite (2024)
Samsung's bloatware is ridiculous. So many preinstalled apps I can't remove.,1,2024-03-02,B0CS5HYQGF,Samsung Galaxy S24 Ultra
No 3.5mm aux input. If your phone dies you can't play music at all.,1,2023-10-19,B09GYRYMQ3,JBL Flip 6 Bluetooth Speaker
"In my opinion, Active noise cancellation is impressive for such small earbuds.",5,2024-02-08,B0D1XD1ZV3,Apple AirPods Pro 2
"Honestly, Mixed feelings. The design is nice but the price is mediocre.",3,2023-05-19,B0BX2L8PBT,Sony WH-1000XM5 Headphones
"Overall, Decent for the price. You get what you pay for with this one.",3,2024-10-26,B0BX2L8PBT,Sony WH-1000XM5 Headphones
I think Active noise cancellation is impressive for such small earbuds.,4,2024-10-22,B0D1XD1ZV3,Apple AirPods Pro 2
"Overall, Bluetooth connection drops randomly on my Windows PC. Have to reconnect constantly.",1,2023-02-17,B09HM94VDS,Logitech MX Master 3S Mouse
I think No Bluetooth audio support without a dongle. How is this still missing?,2,2023-07-20,B098RKWHHZ,Nintendo Switch OLED
"Honestly, Battery lasts 12 hours easily. Took it on a weekend camping trip with no issues.",4,2023-08-11,B09GYRYMQ3,JBL Flip 6 Bluetooth Speaker
"In my opinion, Incredibly comfortable headphones. I wear them for 8-hour work sessions without any ear fatigue.",4,2023-03-15,B0BX2L8PBT,Sony WH-1000XM5 Headphones
"Average product. Some features are great, others are disappointing.",3,2024-03-25,B0CS5HYQGF,Samsung Galaxy S24 Ultra
Works as described. Not amazing but not terrible either.,3,2023-09-26,B09GYRYMQ3,JBL Flip 6 Bluetooth Speaker
"Honestly, The Kindle Paperwhite display is incredible. Reads just like real paper even in sunlight.",5,2023-12-03,B0CFPJYX7P,Kindle Paperwhite (2024)
The thumb button placement causes accidental clicks when gripping normally.,1,2023-03-16,B09HM94VDS,Logitech MX Master 3S Mouse
BUY THIS RIGHT NOW YOU WONT REGRET IT BEST THING EVER MADE,5,2023-02-02,B09HM94VDS,Logitech MX Master 3S Mouse
"I think Average product. Some features are great, others are disappointing.",3,2023-01-19,B098RKWHHZ,Nintendo Switch OLED
Build quality is solid. Dropped it several times and it still works perfectly.,5,2023-06-10,B01JIWQPMW,Anker PowerCore 26800 Power Bank
"Overall, No 3.5mm aux input. If your phone dies you can't play music at all.",2,2023-12-22,B09GYRYMQ3,JBL Flip 6 Bluetooth Speaker
The improved kickstand actually works now. Tabletop mode is finally usable.,4,2024-10-01,B098RKWHHZ,Nintendo Switch OLED
Five stars.,5,2024-08-13,B0CFPJYX7P,Kindle Paperwhite (2024)
The noise cancellation on these Sony headphones is phenomenal. I wear them on flights and can't hear the engine at all.,4,2023-09-20,B0BX2L8PBT,Sony WH-1000XM5 Headphones
I think Ergonomic shape fits my hand perfectly. No more wrist pain after long work days.,5,2024-06-27,B09HM94VDS,Logitech MX Master 3S Mouse
The Galaxy S24 Ultra camera is insane. 200MP main sensor takes incredibly detailed photos.,5,2023-12-05,B0CS5HYQGF,Samsung Galaxy S24 Ultra
I think Decent for the price. You get what you pay for with this one.,3,2024-02-03,B0D1XD1ZV3,Apple AirPods Pro 2
"Overall, Waterproof design means I can read in the bath without worry. Game changer.",5,2024-03-15,B0CFPJYX7P,Kindle Paperwhite (2024)
"In my opinion, The warm light adjustment is perfect for reading at night without straining my eyes.",5,2023-09-02,B0CFPJYX7P,Kindle Paperwhite (2024)
I think USB-C finally! No more carrying a separate Lightning cable.,4,2024-06-06,B0D1XD1ZV3,Apple AirPods Pro 2
I think Battery lasts 12 hours easily. Took it on a weekend camping trip with no issues.,4,2024-06-08,B09GYRYMQ3,JBL Flip 6 Bluetooth Speaker
Mixed feelings. The battery life is nice but the software is mediocre.,3,2023-12-18,B098RKWHHZ,Nintendo Switch OLED
"Honestly, Average product. Some features are great, others are disappointing.",3,2023-09-12,B09HM94VDS,Logitech MX Master 3S Mouse
"Honestly, For $350 these headphones should sound better. My $150 pair had more detail.",1,2024-10-20,B0BX2L8PBT,Sony WH-1000XM5 Headphones
"In my opinion, Page turns are noticeably faster than the previous generation.",5,2024-02-14,B0CFPJYX7P,Kindle Paperwhite (2024)
I think Seamless integration with my iPhone and MacBook. The automatic switching is flawless.,4,2023-08-26,B0D1XD1ZV3,Apple AirPods Pro 2
"Honestly, Works as described. Not amazing but not terrible either.",3,2023-12-08,B09HM94VDS,Logitech MX Master 3S Mouse
This is garbage. Complete junk. Worst thing I ever purchased.,5,2023-04-03,B01JIWQPMW,Anker PowerCore 26800 Power Bank
"In my opinion, Decent for the price. You get what you pay for with this one.",3,2023-04-28,B01JIWQPMW,Anker PowerCore 26800 Power Bank
I think Decent for the price. You get what you pay for with this one.,3,2024-06-06,B0BX2L8PBT,Sony WH-1000XM5 Headphones
"Overall, Wind noise is terrible when walking outside. ANC can't handle it.",2,2024-07-08,B0BX2L8PBT,Sony WH-1000XM5 Headphones
good good good good good good product good good,5,2023-10-21,B01JIWQPMW,Anker PowerCore 26800 Power Bank
"Honestly, The quiet clicks are perfect for late night work without disturbing anyone.",4,2023-02-21,B09HM94VDS,Logitech MX Master 3S Mouse
Ergonomic shape fits my hand perfectly. No more wrist pain after long work days.,5,2023-09-06,B09HM94VDS,Logitech MX Master 3S Mouse
I think Bass is punchy and rich. Way better than expected from a portable speaker.,5,2024-11-26,B09GYRYMQ3,JBL Flip 6 Bluetooth Speaker
I think PartyBoost lets me connect two JBL speakers for stereo sound. Awesome feature.,5,2024-06-04,B09GYRYMQ3,JBL Flip 6 Bluetooth Speaker
I think The multipoint Bluetooth connection works flawlessly between my laptop and phone.,4,2023-08-20,B0BX2L8PBT,Sony WH-1000XM5 Headphones
Battery lasts 12 hours easily. Took it on a weekend camping trip with no issues.,4,2023-07-14,B09GYRYMQ3,JBL Flip 6 Bluetooth Speaker
I think Charging $350 for what is essentially the same console with a better screen is a ripoff.,1,2023-11-26,B098RKWHHZ,Nintendo Switch OLED
"In my opinion, Ear tips don't stay in my ears during runs. Tried all three sizes.",1,2023-06-25,B0D1XD1ZV3,Apple AirPods Pro 2
"Honestly, The noise cancellation on these Sony headphones is phenomenal. I wear them on flights and can't hear the engine at all.",5,2023-07-05,B0BX2L8PBT,Sony WH-1000XM5 Headphones
It's not allowed on some airlines due to capacity. Found out the hard way.,2,2024-01-17,B01JIWQPMW,Anker PowerCore 26800 Power Bank
"In my opinion, The game library is massive. Between first party Nintendo titles and indie games there's always something to play.",5,2023-05-03,B098RKWHHZ,Nintendo Switch OLED
"Overall, Not great for gaming. The sensor is fine for productivity but too slow for FPS games.",1,2023-02-19,B09HM94VDS,Logitech MX Master 3S Mouse
I think Charging $350 for what is essentially the same console with a better screen is a ripoff.,2,2023-02-06,B098RKWHHZ,Nintendo Switch OLED
"In my opinion, Seamless integration with my iPhone and MacBook. The automatic switching is flawless.",4,2024-01-11,B0D1XD1ZV3,Apple AirPods Pro 2
This JBL speaker packs incredible volume for its size. Fills my entire backyard with sound.,4,2023-06-12,B09GYRYMQ3,JBL Flip 6 Bluetooth Speaker
I think The improved kickstand actually works now. Tabletop mode is finally usable.,4,2024-06-20,B098RKWHHZ,Nintendo Switch OLED
"Honestly, No WiFi or smart assistant support. It's just a dumb Bluetooth speaker.",2,2023-03-21,B09GYRYMQ3,JBL Flip 6 Bluetooth Speaker
I think Works on literally any surface including glass. The sensor is incredible.,4,2024-11-18,B09HM94VDS,Logitech MX Master 3S Mouse
The quiet clicks are perfect for late night work without disturbing anyone.,4,2024-08-01,B09HM94VDS,Logitech MX Master 3S Mouse
I think Takes over 8 hours to fully recharge. That's painfully slow.,2,2024-09-17,B01JIWQPMW,Anker PowerCore 26800 Power Bank
USB-C finally! No more carrying a separate Lightning cable.,5,2024-12-16,B0D1XD1ZV3,Apple AirPods Pro 2
The multipoint Bluetooth connection works flawlessly between my laptop and phone.,5,2024-06-08,B0BX2L8PBT,Sony WH-1000XM5 Headphones
This power bank is a brick. Way too heavy to carry in a pocket.,1,2024-10-22,B01JIWQPMW,Anker PowerCore 26800 Power Bank
"Honestly, Works as described. Not amazing but not terrible either.",3,2023-02-06,B01JIWQPMW,Anker PowerCore 26800 Power Bank
"Battery life is amazing, easily lasts 30+ hours on a single charge.",5,2024-10-24,B0BX2L8PBT,Sony WH-1000XM5 Headphones
It's okay. Nothing special but gets the job done for the price.,3,2024-11-07,B0CS5HYQGF,Samsung Galaxy S24 Ultra
"Honestly, No audiobook playback through the speaker. Have to use Bluetooth which is clunky.",2,2023-11-01,B0CFPJYX7P,Kindle Paperwhite (2024)
"Overall, Works as described. Not amazing but not terrible either.",3,2024-07-20,B0D1XD1ZV3,Apple AirPods Pro 2
No 3.5mm aux input. If your phone dies you can't play music at all.,1,2023-11-14,B09GYRYMQ3,JBL Flip 6 Bluetooth Speaker
great,5,2023-02-17,B0CFPJYX7P,Kindle Paperwhite (2024)
"Honestly, The touch controls on the ear cups are way too sensitive. I keep accidentally skipping tracks.",1,2024-04-09,B0BX2L8PBT,Sony WH-1000XM5 Headphones
PartyBoost lets me connect two JBL speakers for stereo sound. Awesome feature.,4,2024-05-18,B09GYRYMQ3,JBL Flip 6 Bluetooth Speaker
Customizable buttons with Logi Options+ make my workflow so much faster.,5,2023-05-02,B09HM94VDS,Logitech MX Master 3S Mouse
"In my opinion, No built-in microphone. Can't use it for speakerphone calls.",2,2023-02-22,B09GYRYMQ3,JBL Flip 6 Bluetooth Speaker
"In my opinion, Online service is still terrible compared to Xbox and PlayStation.",1,2024-09-25,B098RKWHHZ,Nintendo Switch OLED
"Honestly, The rugged build has survived multiple drops onto concrete. Practically indestructible.",5,2023-11-22,B09GYRYMQ3,JBL Flip 6 Bluetooth Speaker
"Honestly, Charging case with the speaker is great for finding it when I inevitably lose it.",5,2024-01-07,B0D1XD1ZV3,Apple AirPods Pro 2
The touch controls on the ear cups are way too sensitive. I keep accidentally skipping tracks.,1,2023-03-01,B0BX2L8PBT,Sony WH-1000XM5 Headphones
"Honestly, At $100 for a mouse, this is overpriced. Good but not $100 good.",2,2023-01-08,B09HM94VDS,Logitech MX Master 3S Mouse
Ads on the lock screen are annoying. Having to pay $20 extra to remove them is greedy.,2,2024-07-28,B0CFPJYX7P,Kindle Paperwhite (2024)
Takes over 8 hours to fully recharge. That's painfully slow.,2,2024-01-20,B01JIWQPMW,Anker PowerCore 26800 Power Bank
"In my opinion, Build quality is solid. Dropped it several times and it still works perfectly.",4,2023-10-28,B01JIWQPMW,Anker PowerCore 26800 Power Bank
"Overall, The warm light adjustment is perfect for reading at night without straining my eyes.",4,2024-05-26,B0CFPJYX7P,Kindle Paperwhite (2024)
Mixed feelings. The build quality is nice but durability is mediocre.,3,2023-03-19,B09GYRYMQ3,JBL Flip 6 Bluetooth Speaker
"Battery life is amazing, easily lasts 30+ hours on a single charge.",5,2024-11-27,B0BX2L8PBT,Sony WH-1000XM5 Headphones
It's not allowed on some airlines due to capacity. Found out the hard way.,1,2023-04-26,B01JIWQPMW,Anker PowerCore 26800 Power Bank
"Honestly, Average product. Some features are great, others are disappointing.",3,2023-05-02,B098RKWHHZ,Nintendo Switch OLED
great,5,2023-06-08,B09HM94VDS,Logitech MX Master 3S Mouse
The LED indicators clearly show remaining battery level.,5,2024-03-28,B01JIWQPMW,Anker PowerCore 26800 Power Bank
"In my opinion, Average product. Some features are great, others are disappointing.",3,2023-08-13,B098RKWHHZ,Nintendo Switch OLED
I think Samsung's bloatware is ridiculous. So many preinstalled apps I can't remove.,2,2023-05-25,B0CS5HYQGF,Samsung Galaxy S24 Ultra
"Honestly, Decent for the price. You get what you pay for with this one.",3,2023-02-01,B01JIWQPMW,Anker PowerCore 26800 Power Bank
"Overall, The quiet clicks are perfect for late night work without disturbing anyone.",5,2024-07-22,B09HM94VDS,Logitech MX Master 3S Mouse
I think Very lightweight for over-ear headphones. Barely notice I'm wearing them.,5,2023-04-08,B0BX2L8PBT,Sony WH-1000XM5 Headphones
Takes over 8 hours to fully recharge. That's painfully slow.,2,2024-01-12,B01JIWQPMW,Anker PowerCore 26800 Power Bank
"Honestly, Battery lasts 12 hours easily. Took it on a weekend camping trip with no issues.",4,2023-11-03,B09GYRYMQ3,JBL Flip 6 Bluetooth Speaker
"In my opinion, No Bluetooth audio support without a dongle. How is this still missing?",2,2023-03-28,B098RKWHHZ,Nintendo Switch OLED
Ear tips don't stay in my ears during runs. Tried all three sizes.,2,2023-10-28,B0D1XD1ZV3,Apple AirPods Pro 2
"Overall, Samsung's bloatware is ridiculous. So many preinstalled apps I can't remove.",2,2023-05-07,B0CS5HYQGF,Samsung Galaxy S24 Ultra
"Honestly, The Galaxy S24 Ultra camera is insane. 200MP main sensor takes incredibly detailed photos.",4,2023-10-20,B0CS5HYQGF,Samsung Galaxy S24 Ultra
I think Build quality is solid. Dropped it several times and it still works perfectly.,5,2023-10-17,B01JIWQPMW,Anker PowerCore 26800 Power Bank
The touch controls on the ear cups are way too sensitive. I keep accidentally skipping tracks.,1,2023-07-08,B0BX2L8PBT,Sony WH-1000XM5 Headphones
Local multiplayer with Joy-Cons is still the best couch gaming experience.,5,2023-04-15,B098RKWHHZ,Nintendo Switch OLED
"Honestly, No 3.5mm aux input. If your phone dies you can't play music at all.",2,2023-07-21,B09GYRYMQ3,JBL Flip 6 Bluetooth Speaker
